,dt,Bonete_level,Manuel_Díaz_level,Cuñapirú_level,Mazangano_level,Coelho_level,Paso_de_las_Toscas_level,Aguiar_level,Laguna_I_level,Laguna_II_level,Pereira_level,San_Gregorio_level,Paso_de_los_Toros_level,Salsipuedes_level,Sarandi_del_Yi_level,Durazno_level,Polanco_level,Lugo_level,Mercedes_level,Villa_Soriano_level,dt,Bonete_precipitation,Manuel_Diaz_precipitation,Cuñapirú_precipitation,Mazagano_precipitation,Coelho_precipitation,Paso_de_las_Toscas_precipitation,Aguiar_precipitation,Laguna_I_precipitation,Laguna_II_precipitation,Pereira_precipitation,San_Gregorio_precipitation,Paso_de_los_toros_precipitation,Salsipuedes_precipitation,Sarandi_del_Yi_precipitation,Polanco_precipitation,Durazno_precipitation,Paso_de_Lugo_precipitation,Mercedes_precipitation,Villa_Soriano_precipitation
0,01/01/2015 07:00,80.74,5.83,2.36,4.25,3.05,0.89,4.45,4.96,5.08,4.035,10.93,8.07,1.98,1.3975,0.36,2.7975,2.04,1.85,1.75,2015-01-01 07:00:00,0.0,0.0,0.0,0.0,0.0,0.0,0.0,0.0,0.0,0.0,0.0,0.0,1.0,0.0,0.0,0.0,0.0,0.0,0.0
1,02/01/2015 07:00,80.71,5.4,2.43,4.06,3.21,0.86,4.53,4.81,5.02,4.035,10.98,8.0,1.92,1.3975,0.31,2.7975,1.66,1.85,1.8,2015-01-02 07:00:00,21.0,20.0,20.0,20.0,18.0,24.0,13.0,5.0,10.0,20.0,18.0,17.0,5.0,10.0,10.0,1.0,11.0,8.0,3.0
2,03/01/2015 07:00,80.75,4.75,2.4,3.87,3.19,0.82,4.5,4.8,4.98,4.1225000000000005,10.97,7.9,1.83,1.2425,0.33,2.5324999999999998,1.53,2.2,2.16,2015-01-03 07:00:00,0.0,0.0,0.0,0.0,0.0,0.0,0.0,0.0,0.0,0.0,0.0,0.0,0.0,0.0,0.0,0.0,0.0,0.0,0.0
3,04/01/2015 07:00,80.75,4.19,2.06,3.99,3.14,0.77,4.38,4.81,4.99,4.07,10.96,7.85,1.81,1.2149999999999999,0.31,2.4575,1.47,1.58,1.85,2015-01-04 07:00:00,0.0,0.0,0.0,0.0,0.0,0.0,0.0,0.0,0.0,0.0,0.0,0.0,0.0,0.0,0.0,0.0,0.0,0.0,0.0
4,05/01/2015 07:00,80.78,3.68,1.9,4.23,3.46,0.8,4.34,4.81,4.98,3.4400000000000004,10.97,7.78,1.92,1.13,0.36,2.435,1.43,1.85,2.12,2015-01-05 07:00:00,0.0,0.0,0.0,0.0,0.0,0.0,0.0,0.0,0.0,0.0,0.0,0.0,0.0,0.0,0.0,0.0,0.0,0.0,0.0
5,06/01/2015 07:00,80.75,3.3,2.03,4.33,3.81,1.07,4.44,4.8,4.97,3.4400000000000004,10.95,8.02,1.89,1.1425,0.4,2.2024999999999997,1.41,1.67,1.89,2015-01-06 07:00:00,0.0,0.0,0.0,0.0,0.0,0.0,0.0,0.0,0.0,0.0,0.0,0.0,0.0,0.0,0.0,0.0,0.0,0.0,0.0
6,07/01/2015 07:00,80.84,3.28,2.35,4.32,4.27,1.45,4.67,5.01,5.25,4.3925,11.08,8.0,2.72,2.3524999999999996,3.02,4.27,3.86,2.2,2.0,2015-01-07 07:00:00,33.0,38.0,38.0,59.0,48.0,45.0,66.0,65.0,95.0,78.0,95.0,15.0,60.0,52.0,46.0,116.0,112.0,90.0,58.0
7,08/01/2015 07:00,80.86,3.84,2.72,4.28,4.67,1.51,4.77,5.37,5.4,4.085,11.08,8.05,2.45,1.6424999999999998,2.18,3.4375,2.85,2.75,2.35,2015-01-08 07:00:00,0.0,15.0,20.0,7.0,5.0,5.0,4.0,0.0,12.0,2.0,0.0,0.0,0.0,0.0,0.0,0.0,0.0,0.0,0.0
8,09/01/2015 07:00,80.86,4.4,2.68,4.22,4.76,1.48,4.83,5.23,5.35,4.11,11.1,8.05,1.81,1.31,1.57,3.34,2.52,2.92,2.45,2015-01-09 07:00:00,0.0,0.0,0.0,0.0,0.0,0.0,0.0,15.0,0.0,0.0,0.0,0.0,0.0,0.0,0.0,0.0,0.0,11.0,1.0
9,10/01/2015 07:00,80.86,4.97,2.11,4.11,4.72,1.55,4.84,5.09,5.36,4.11,11.1,8.01,1.93,1.31,1.86,3.34,2.65,3.1,2.42,2015-01-10 07:00:00,4.0,2.0,5.0,5.0,0.0,0.0,14.0,10.0,16.0,10.0,25.0,3.0,5.0,11.0,15.0,11.0,15.0,12.0,2.0
10,11/01/2015 07:00,80.88,5.48,2.18,3.99,4.78,1.78,4.78,5.05,5.35,4.1450000000000005,11.1,8.1,2.1,1.33,2.74,3.63,2.24,3.0,2.35,2015-01-11 07:00:00,0.0,0.0,0.0,0.0,0.0,0.0,0.0,2.0,0.0,0.0,0.0,0.0,0.0,0.0,0.0,0.0,0.0,7.0,5.0
11,12/01/2015 07:00,80.86,5.87,2.17,3.86,4.91,1.88,4.74,5.03,5.35,4.1275,11.12,8.0,1.84,1.335,2.18,3.465,2.12,2.85,2.4,2015-01-12 07:00:00,0.0,13.0,12.0,3.0,5.0,4.0,3.0,0.0,2.0,5.0,5.0,0.0,3.0,0.0,0.0,0.0,0.0,0.0,0.0
12,13/01/2015 07:00,80.88,6.05,2.42,3.76,4.94,1.8,4.68,5.09,5.32,4.1274999999999995,11.1,8.0,1.82,1.335,1.86,3.465,1.91,2.55,2.4,2015-01-13 07:00:00,0.0,0.0,0.0,0.0,0.0,0.0,0.0,0.0,0.0,0.0,0.0,0.0,0.0,0.0,0.0,0.0,0.0,0.0,0.0
13,14/01/2015 07:00,80.94,6.05,2.51,3.77,5.02,1.88,4.69,5.28,5.44,4.8275,11.19,8.5,5.43,3.1850000000000005,3.62,3.7,3.61,3.0,2.85,2015-01-14 07:00:00,46.0,18.0,22.0,30.0,30.0,36.0,28.0,55.0,49.0,32.0,46.0,50.0,45.0,83.0,40.0,47.0,60.0,32.0,44.0
14,15/01/2015 07:00,80.94,5.84,2.46,3.85,5.02,1.84,4.65,5.52,5.55,3.87,11.16,8.35,2.38,2.84,4.66,5.75,4.88,3.45,2.75,2015-01-15 07:00:00,0.0,0.0,0.0,0.0,0.0,0.0,0.0,0.0,0.0,0.0,0.0,0.0,0.0,0.0,0.0,0.0,0.0,0.0,0.0
15,16/01/2015 07:00,80.94,5.51,2.36,3.89,4.89,1.84,4.65,5.62,5.61,3.43,11.15,8.35,1.92,2.8075,5.61,6.555,5.24,4.0,2.85,2015-01-16 07:00:00,0.0,0.0,0.0,0.0,0.0,0.0,0.0,0.0,0.0,0.0,0.0,0.0,0.0,0.0,0.0,0.0,0.0,0.0,0.0
16,17/01/2015 07:00,80.96,5.05,2.18,3.88,4.82,1.77,4.66,5.73,5.71,4.0025,11.21,8.15,1.95,3.1725,5.86,6.99,3.82,4.1,2.65,2015-01-17 07:00:00,18.0,10.0,15.0,0.0,0.0,0.0,0.0,0.0,0.0,0.0,0.0,9.0,0.0,14.0,14.0,15.0,12.0,0.0,0.0
17,18/01/2015 07:00,80.96,4.37,2.04,3.82,4.81,1.74,4.65,5.79,5.75,5.48,11.17,8.35,2.0,3.425,6.3,6.99,2.87,3.62,2.91,2015-01-18 07:00:00,0.0,0.0,0.0,0.0,0.0,0.0,0.0,0.0,0.0,0.0,0.0,0.0,0.0,0.0,0.0,0.0,0.0,0.0,0.0
18,19/01/2015 07:00,80.94,3.88,2.02,3.75,4.71,1.63,4.57,5.79,5.71,5.709999999999999,11.15,8.25,1.89,3.3,5.97,6.775,2.26,3.4,2.63,2015-01-19 07:00:00,33.0,10.0,8.0,1.0,13.0,2.0,5.0,20.0,14.0,5.0,8.0,59.0,18.0,1.0,0.0,2.0,10.0,26.0,30.0
19,20/01/2015 07:00,80.94,3.97,2.06,3.69,4.48,1.47,4.46,5.79,5.69,4.715,11.13,8.15,1.85,2.875,4.75,5.9425,2.04,3.3,2.84,2015-01-20 07:00:00,6.0,14.0,8.0,5.0,6.0,11.0,11.0,4.75,21.0,5.0,12.0,0.0,2.0,22.0,43.0,5.0,5.0,6.0,9.0
20,21/01/2015 07:00,80.9,4.31,1.73,3.61,4.12,1.35,4.32,5.66,5.58,4.5075,11.14,8.17,1.94,1.38,3.86,4.04,1.96,3.52,2.8,2015-01-21 07:00:00,0.0,0.0,1.0,0.0,1.0,0.0,0.0,0.0,0.0,0.0,0.0,0.0,0.0,0.0,0.0,0.0,0.0,0.0,0.0
21,22/01/2015 07:00,80.8,4.45,1.59,3.49,3.78,1.3,4.19,5.41,5.43,3.9524999999999997,11.11,8.21,1.88,1.3975,2.89,4.2775,2.1,3.15,2.55,2015-01-22 07:00:00,0.0,0.0,0.0,0.0,0.0,0.0,0.0,0.0,0.0,0.0,0.0,0.0,0.0,0.0,0.0,0.0,0.0,0.0,0.0
22,23/01/2015 07:00,80.86,4.21,1.69,3.25,3.39,1.22,4.06,5.02,5.2,4.3999999999999995,11.05,8.15,1.83,1.4975,1.72,3.0175,2.12,2.6,2.26,2015-01-23 07:00:00,0.0,0.0,0.0,0.0,0.0,0.0,0.0,0.0,0.0,0.0,0.0,0.0,0.0,0.0,0.0,0.0,0.0,0.0,0.0
23,24/01/2015 07:00,80.81,3.55,1.7,2.82,2.94,1.13,3.88,4.61,4.98,4.550000000000001,11.0,8.2,2.0,1.33,1.5,2.7624999999999997,1.98,2.5,2.08,2015-01-24 07:00:00,0.0,0.0,0.0,0.0,0.0,0.0,0.0,0.0,0.0,0.0,0.0,0.0,0.0,0.0,0.0,0.0,0.0,0.0,0.0
24,25/01/2015 07:00,80.78,2.59,1.7,2.27,2.58,1.04,3.57,4.3,4.82,3.9325,10.97,8.22,1.9,1.28,1.39,3.2800000000000002,1.82,2.2,2.05,2015-01-25 07:00:00,0.0,0.0,0.0,0.0,0.0,0.0,0.0,0.0,0.0,0.0,0.0,0.0,0.0,0.0,0.0,0.0,0.0,0.0,0.0
25,26/01/2015 07:00,80.71,1.7,1.48,1.85,2.41,0.97,3.1,4.12,4.73,3.21,10.92,8.1,1.88,1.2375,1.15,2.6174999999999997,1.7,2.0,2.0,2015-01-26 07:00:00,0.0,0.0,0.0,0.0,0.0,0.0,0.0,0.0,0.0,0.0,0.0,0.0,0.0,0.0,0.0,0.0,0.0,0.0,0.0
26,27/01/2015 07:00,80.69,1.35,1.16,1.63,2.28,0.89,2.68,3.92,4.61,3.71,10.89,8.1,1.94,1.21,0.92,2.2925,1.6,2.0,2.0,2015-01-27 07:00:00,0.0,0.0,0.0,0.0,0.0,0.0,0.0,0.0,0.0,0.0,0.0,0.0,0.0,0.0,0.0,0.0,0.0,0.0,0.0
27,28/01/2015 07:00,80.65,1.43,1.11,1.5,2.13,0.81,2.44,3.59,4.49,2.7275,10.87,8.05,1.81,1.2325,0.73,1.8275,1.6,1.8,1.75,2015-01-28 07:00:00,0.0,0.0,0.0,0.0,0.0,0.0,1.0,42.0,28.0,0.0,6.0,2.0,0.0,2.0,0.0,2.0,5.0,1.0,0.0
28,29/01/2015 07:00,80.63,2.15,1.37,1.49,2.09,0.78,2.32,3.25,4.44,2.6475,10.89,8.0,1.82,1.275,0.61,3.0174999999999996,3.11,2.15,2.46,2015-01-29 07:00:00,8.0,35.0,28.0,32.0,29.0,28.0,29.0,28.0,40.0,30.0,32.0,11.0,8.0,16.0,60.0,12.0,20.0,41.0,49.0
29,30/01/2015 07:00,80.65,2.42,1.23,1.75,2.11,0.74,2.36,2.9,4.32,2.67,10.84,8.05,1.94,1.2850000000000001,0.97,3.0625,4.56,2.44,2.43,2015-01-30 07:00:00,0.0,0.0,0.0,0.0,0.0,0.0,0.0,0.0,0.0,0.0,0.0,0.0,0.0,0.0,0.0,0.0,0.0,0.0,0.0
30,31/01/2015 07:00,80.65,1.99,1.02,1.81,2.21,0.75,2.52,2.88,4.3,2.63,10.8,8.1,1.89,1.8124999999999998,1.04,3.2725,3.38,1.85,2.0,2015-01-31 07:00:00,0.0,0.0,0.0,0.0,0.0,0.0,0.0,0.0,0.0,0.0,0.0,0.0,0.0,0.0,0.0,0.0,0.0,0.0,0.0
31,01/02/2015 07:00,80.59,1.39,0.93,1.83,2.21,0.79,2.56,3.05,4.24,2.64,10.78,7.9,1.83,1.24,0.87,2.9425,2.96,1.65,1.67,2015-02-01 07:00:00,0.0,0.0,0.0,0.0,0.0,0.0,0.0,0.0,0.0,0.0,0.0,0.0,0.0,0.0,0.0,0.0,0.0,0.0,0.0
32,02/02/2015 07:00,80.59,1.18,0.95,1.91,2.04,0.8,2.57,3.05,4.24,2.65,10.78,7.85,1.88,1.2,0.71,2.77,2.49,1.62,1.56,2015-02-02 07:00:00,0.0,0.0,0.0,0.0,0.0,0.0,0.0,0.0,0.0,0.0,0.0,0.0,0.0,0.0,0.0,0.0,0.0,0.0,0.0
33,03/02/2015 07:00,80.55,1.03,0.92,2.03,1.9,0.81,2.63,2.85,4.18,2.62,10.73,7.94,1.76,1.04,0.59,2.625,2.05,1.64,1.74,2015-02-03 07:00:00,0.0,0.0,0.0,0.0,0.0,0.0,0.0,0.0,0.0,0.0,0.0,0.0,0.0,0.0,0.0,0.0,0.0,0.0,0.0
34,04/02/2015 07:00,80.53,0.92,0.89,2.15,1.88,0.81,2.74,2.6,4.1,2.62,10.65,7.95,1.71,1.1225,0.47,2.34,1.85,1.63,1.75,2015-02-04 07:00:00,0.0,0.0,0.0,0.0,0.0,0.0,0.0,0.0,0.0,0.0,0.0,0.0,0.0,0.0,0.0,0.0,0.0,0.0,0.0
35,05/02/2015 07:00,80.46,0.84,0.81,2.18,1.87,0.78,2.79,2.39,4.02,2.67,10.65,7.8,1.7,1.335,0.4,1.8675,1.72,1.5,1.65,2015-02-05 07:00:00,0.0,0.0,0.0,0.0,3.0,0.0,8.0,0.0,0.0,0.0,0.0,1.0,0.0,0.0,0.0,0.0,0.0,0.0,0.0
36,06/02/2015 07:00,80.4,0.78,0.79,2.0,1.83,0.75,2.81,2.22,3.98,2.71,10.62,7.79,1.74,1.335,0.33,1.8675,1.6775,1.48,1.48,2015-02-06 07:00:00,0.0,0.0,0.0,0.0,0.0,0.0,0.0,0.0,0.0,0.0,0.0,0.0,0.0,0.0,0.0,0.0,0.0,3.0,5.0
37,07/02/2015 07:00,80.34,0.74,0.81,1.69,1.77,0.7,2.69,2.07,3.95,2.74,10.56,7.8,1.62,1.31,0.29,2.1775,1.59,1.35,1.5,2015-02-07 07:00:00,0.0,0.0,0.0,0.0,0.0,0.0,0.0,0.0,0.0,0.0,0.0,0.0,0.0,0.0,0.0,0.0,0.0,0.0,0.0
38,08/02/2015 07:00,80.31,0.69,0.76,1.47,1.72,0.66,2.47,1.96,3.89,2.69,10.51,7.8,1.45,1.42,0.24,1.6375000000000002,1.55,1.5,1.65,2015-02-08 07:00:00,0.0,0.0,0.0,0.0,0.0,0.0,0.0,0.0,0.0,0.0,0.0,0.0,0.0,0.0,0.0,0.0,0.0,0.0,0.0
39,09/02/2015 07:00,80.25,0.65,0.75,1.37,1.68,0.63,2.27,1.87,3.83,2.57,10.44,7.52,1.44,1.3049999999999997,0.22,1.6775,1.52,1.4,1.4,2015-02-09 07:00:00,4.0,0.0,0.0,0.0,0.0,0.0,0.0,0.0,0.0,0.0,0.0,0.0,0.0,0.0,6.0,8.0,1.0,0.0,0.0
40,10/02/2015 07:00,80.21,0.61,0.76,1.31,1.66,0.6,2.13,1.82,3.81,2.41,10.42,7.55,1.47,1.065,0.17,1.5425,1.5,1.7,1.59,2015-02-10 07:00:00,0.0,0.0,0.0,0.0,0.0,0.0,0.0,1.25,1.0,1.0,0.0,0.0,0.0,0.0,0.0,0.0,1.0,4.0,6.0
41,11/02/2015 07:00,80.15,0.59,0.76,1.33,1.64,0.58,2.06,1.75,3.74,2.29,10.37,7.65,1.52,1.0675,0.14,1.58,1.48,2.0,1.7,2015-02-11 07:00:00,1.0,11.0,10.0,36.0,0.0,1.0,7.0,0.0,0.0,0.0,0.0,1.0,0.0,2.0,0.0,2.0,4.0,1.0,2.0
42,12/02/2015 07:00,80.13,0.57,0.75,1.34,1.64,0.56,2.13,1.71,3.69,2.2550000000000003,10.32,7.62,1.47,1.0875000000000001,0.12,1.5125,1.46,1.9,1.45,2015-02-12 07:00:00,0.0,0.0,0.0,0.0,0.0,0.0,0.0,0.0,0.0,0.0,0.0,0.0,0.0,0.0,0.0,0.0,0.0,0.0,0.0
43,13/02/2015 07:00,80.06,0.7,0.76,1.32,1.65,0.55,2.18,1.7,3.71,2.3625,10.26,7.54,1.47,1.1025,0.1,1.4700000000000002,1.45,1.73,1.43,2015-02-13 07:00:00,0.0,0.0,0.0,0.0,0.0,0.0,0.0,0.0,0.0,0.0,0.0,0.0,0.0,0.0,0.0,0.0,0.0,0.0,0.0
44,14/02/2015 07:00,80.03,0.76,0.81,1.3,1.65,0.53,2.15,1.67,3.52,2.19,10.2,7.6,1.49,1.0750000000000002,0.05,1.5699999999999998,1.42,2.1,2.02,2015-02-14 07:00:00,0.0,0.0,0.0,0.0,0.0,0.0,0.0,0.0,0.0,0.0,0.0,0.0,0.0,0.0,0.0,0.0,0.0,0.0,0.0
45,15/02/2015 07:00,79.96,0.68,0.8,1.33,1.67,0.53,2.11,1.65,3.48,2.18,10.13,7.62,1.46,1.1025,0.05,1.47,1.41,1.75,1.65,2015-02-15 07:00:00,0.0,0.0,0.0,0.0,0.0,0.0,0.0,0.0,0.0,0.0,0.0,0.0,0.0,0.0,0.0,0.0,0.0,0.0,0.0
46,16/02/2015 07:00,79.94,0.58,0.78,1.43,1.66,0.54,2.12,1.65,3.43,2.16,10.08,7.55,1.44,1.1225,0.03,1.425,1.4,1.4,1.3,2015-02-16 07:00:00,0.0,0.0,0.0,0.0,0.0,0.0,0.0,0.0,0.0,0.0,0.0,1.0,0.0,0.0,0.0,0.0,0.0,0.0,0.0
47,17/02/2015 07:00,79.86,0.52,0.76,1.49,1.63,0.55,2.18,1.65,3.37,2.24,10.03,7.52,1.56,1.11,0.0,1.6625,1.38,1.24,1.15,2015-02-17 07:00:00,0.0,0.0,0.0,0.0,0.0,0.0,0.0,0.0,0.0,0.0,0.0,0.0,0.0,0.0,0.0,0.0,0.0,0.0,0.0
48,18/02/2015 07:00,79.81,0.48,0.75,1.45,1.63,0.54,2.22,1.65,3.28,2.12,9.98,7.78,1.66,1.1575,0.0,1.6900000000000002,1.37,0.6,1.2,2015-02-18 07:00:00,0.0,0.0,0.0,0.0,0.0,0.0,0.0,0.0,0.0,0.0,0.0,0.0,0.0,0.0,0.0,0.0,0.0,0.0,0.0
49,19/02/2015 07:00,79.75,0.45,0.73,1.37,1.62,0.53,2.19,1.66,3.41,2.17,9.95,7.82,1.72,1.15,0.0,1.7325000000000002,1.39,1.0,1.1,2015-02-19 07:00:00,6.0,3.0,0.0,3.0,4.75,0.0,5.0,0.0,18.0,2.0,15.0,28.0,11.0,55.0,11.0,12.0,18.0,15.0,20.0
50,20/02/2015 07:00,79.71,0.49,0.73,1.27,1.62,0.54,2.12,1.64,3.34,2.21,9.92,7.87,1.71,1.2149999999999999,0.0,1.42,1.39,2.0,2.2,2015-02-20 07:00:00,2.0,8.0,6.0,2.0,2.0,3.0,2.0,0.0,9.0,6.0,6.0,3.0,2.0,0.0,0.0,0.0,0.0,0.0,0.0
51,21/02/2015 07:00,79.69,0.79,0.71,1.2,1.62,0.52,2.03,1.62,3.24,2.19,9.84,7.88,1.81,1.2149999999999999,0.0,1.42,1.39,1.75,2.0,2015-02-21 07:00:00,0.0,0.0,0.0,0.0,0.0,0.0,0.0,0.0,0.0,0.0,0.0,0.0,0.0,0.0,0.0,0.0,0.0,0.0,0.0
52,22/02/2015 07:00,79.61,0.7,0.71,1.16,1.62,0.51,1.97,1.72,3.12,2.15,9.8,8.05,1.92,1.1424999999999998,0.0,1.71,1.39,1.35,1.7,2015-02-22 07:00:00,0.0,0.0,0.0,0.0,0.0,0.0,0.0,0.0,0.0,0.0,0.0,0.0,0.0,0.0,0.0,0.0,0.0,0.0,0.0
53,23/02/2015 07:00,79.56,0.71,0.71,1.16,1.62,0.5,1.92,1.9,3.13,2.08,9.75,8.2,1.95,1.1524999999999999,0.0,1.67,1.38,0.85,1.49,2015-02-23 07:00:00,0.0,6.0,0.0,0.0,0.0,0.0,0.0,0.0,0.0,0.0,0.0,0.0,0.0,0.0,0.0,0.0,0.0,0.0,0.0
54,24/02/2015 07:00,79.53,1.13,0.72,1.21,1.64,0.49,1.92,1.95,3.1,2.1375,9.69,8.1,1.86,1.135,0.0,1.7475,1.37,0.95,1.5,2015-02-24 07:00:00,0.0,0.0,3.0,4.0,0.0,0.0,0.0,0.0,0.0,0.0,0.0,0.0,0.0,0.0,0.0,0.0,0.0,0.0,0.0
55,25/02/2015 07:00,79.46,1.19,0.73,1.23,1.64,0.49,1.97,1.94,3.03,2.2424999999999997,9.64,7.91,1.73,1.1275,0.0,1.92,1.36,1.85,1.35,2015-02-25 07:00:00,0.0,0.0,0.0,0.0,0.0,0.0,0.0,0.0,0.0,0.0,0.0,0.0,0.0,0.0,0.0,0.0,0.0,0.0,0.0
56,26/02/2015 07:00,79.38,0.8,0.73,1.28,1.78,0.55,2.0,2.03,3.02,2.12,9.59,7.73,1.6,1.155,0.0,1.5474999999999999,1.52,2.05,2.25,2015-02-26 07:00:00,2.0,5.0,8.0,22.0,11.0,45.0,1.0,12.75,12.0,24.0,1.0,2.0,26.0,0.0,0.0,0.0,20.0,5.0,5.0
57,27/02/2015 07:00,79.34,0.92,0.76,1.34,1.8,0.54,2.08,2.05,3.04,2.18,9.57,7.82,1.57,1.1849999999999998,0.0,1.5125,1.7449999999999999,2.0,1.75,2015-02-27 07:00:00,6.0,7.0,10.0,1.0,0.0,0.0,1.0,0.0,0.0,0.5,3.0,4.0,5.0,5.0,1.0,0.0,0.0,0.0,0.0
58,28/02/2015 07:00,79.3,2.21,0.89,1.37,1.77,0.52,2.14,1.97,2.98,2.2875,9.48,7.68,1.54,1.1375000000000002,0.0,1.925,1.65,1.95,2.25,2015-02-28 07:00:00,0.0,0.0,0.0,0.0,0.0,0.0,1.0,0.0,0.0,0.5,0.0,1.0,0.0,0.0,0.0,0.0,0.0,0.0,0.0
59,01/03/2015 07:00,79.3,2.37,1.01,1.39,1.9,0.51,2.15,1.83,2.84,2.0300000000000002,9.4,7.7,1.55,1.1675,0.0,1.9100000000000001,1.53,1.7,1.9,2015-03-01 07:00:00,0.0,0.0,0.0,0.0,0.0,0.0,0.0,0.0,0.0,0.0,0.0,1.0,0.0,0.0,0.0,0.0,0.0,0.0,0.0
60,02/03/2015 07:00,79.19,1.94,1.14,1.46,1.95,0.52,2.15,1.87,2.77,1.945,9.39,7.7,1.55,1.1425,0.0,1.52,1.46,1.52,1.35,2015-03-02 07:00:00,0.0,28.0,12.0,4.0,13.0,8.0,5.0,0.0,18.0,11.0,2.0,1.0,0.0,0.0,0.0,0.0,0.0,2.0,3.0
61,03/03/2015 07:00,79.13,2.11,1.25,1.59,1.89,0.53,2.21,2.16,2.86,2.185,9.33,7.64,1.47,1.22,0.0,1.7374999999999998,1.42,1.65,1.15,2015-03-03 07:00:00,0.0,0.0,0.0,0.0,0.0,0.0,0.0,0.0,0.0,0.0,0.0,1.0,0.0,0.0,0.0,0.0,0.0,0.0,0.0
62,04/03/2015 07:00,79.09,4.0,1.91,1.73,1.89,0.6,2.35,2.37,2.93,2.16,9.29,7.55,1.38,1.1375,0.0,1.655,1.93,2.05,1.75,2015-03-04 07:00:00,29.0,114.0,75.0,24.0,51.0,35.0,38.0,42.0,40.0,26.0,6.0,40.0,30.0,15.0,10.0,20.0,17.0,40.0,68.0
63,05/03/2015 07:00,79.05,4.59,2.11,1.91,2.26,0.65,2.49,2.76,3.04,2.26,9.24,7.61,1.37,1.1375,0.0,1.585,2.49,2.1,1.55,2015-03-05 07:00:00,0.0,3.0,3.0,25.0,2.0,1.0,2.0,0.0,1.0,3.0,0.0,0.0,0.0,0.0,0.0,0.0,0.0,0.0,0.0
64,06/03/2015 07:00,79.0,5.09,1.89,1.95,2.47,0.68,2.65,3.14,3.22,2.39,9.19,7.57,1.36,1.125,0.0,1.64,2.06,1.95,1.6,2015-03-06 07:00:00,0.0,0.0,0.0,0.0,0.0,0.0,0.0,0.0,0.0,0.0,0.0,0.0,0.0,0.0,0.0,0.0,0.0,0.0,0.0
65,07/03/2015 07:00,78.99,5.64,1.65,1.8,2.62,0.73,2.66,3.54,3.48,2.49,9.14,7.5,1.49,1.125,0.0,1.55,1.79,1.65,1.42,2015-03-07 07:00:00,0.0,0.0,0.0,0.0,0.0,0.0,0.0,0.0,0.0,0.0,0.0,0.0,0.0,0.0,0.0,0.0,0.0,0.0,0.0
66,08/03/2015 07:00,78.94,5.72,1.59,1.7,2.47,0.78,2.55,3.83,3.7,2.53,9.1,7.68,1.65,1.125,0.0,1.56,1.71,1.21,1.29,2015-03-08 07:00:00,0.0,0.0,0.0,0.0,0.0,0.0,0.0,0.0,0.0,0.0,0.0,0.0,0.0,0.0,0.0,0.0,0.0,0.0,0.0
67,09/03/2015 07:00,78.88,5.39,1.64,1.65,2.17,0.78,2.44,4.02,3.85,2.48,9.08,7.85,1.66,1.125,0.0,1.56,1.67,0.9,1.3,2015-03-09 07:00:00,0.0,0.0,0.0,0.0,0.0,0.0,0.0,0.0,0.0,0.0,0.0,0.0,0.0,0.0,0.0,0.0,0.0,0.0,0.0
68,10/03/2015 07:00,78.84,4.54,1.73,1.57,1.97,0.77,2.38,4.11,3.92,2.39,9.05,7.75,1.67,1.125,0.0,1.6,1.61,1.53,1.58,2015-03-10 07:00:00,0.0,0.0,0.0,0.0,0.0,0.0,0.0,0.0,0.0,0.0,0.0,0.0,0.0,0.0,0.0,0.0,0.0,0.0,0.0
69,11/03/2015 07:00,78.78,3.17,1.7,1.45,1.88,0.74,2.29,4.19,4.14,2.32,9.0,7.77,1.62,1.14,0.0,1.69,1.54,1.6,1.47,2015-03-11 07:00:00,0.0,0.0,0.0,0.0,0.0,0.0,0.0,0.0,0.0,0.0,0.0,0.0,0.0,0.0,0.0,0.0,0.0,0.0,0.0
70,12/03/2015 07:00,78.75,1.74,1.52,1.34,1.83,0.71,2.18,4.26,4.03,2.26,8.96,7.73,1.59,1.1349999999999998,0.0,1.73,1.48,1.57,1.45,2015-03-12 07:00:00,0.0,0.0,0.0,0.0,0.0,0.0,0.0,0.0,0.0,0.0,0.0,0.0,0.0,0.0,0.0,0.0,0.0,0.0,0.0
71,13/03/2015 07:00,78.74,1.14,1.24,1.25,1.76,0.67,2.06,4.27,4.05,2.19,8.95,7.73,1.59,1.1349999999999998,0.0,1.73,1.43,1.68,1.5,2015-03-13 07:00:00,0.0,0.0,0.0,0.0,0.0,0.0,0.0,0.0,0.0,0.0,0.0,0.0,0.0,0.0,0.0,0.0,0.0,0.0,0.0
72,14/03/2015 07:00,78.69,0.98,1.03,1.19,1.7,0.63,1.97,4.08,3.95,2.11,8.92,7.73,1.59,1.1349999999999998,0.0,1.7,1.39,1.7,1.31,2015-03-14 07:00:00,0.0,0.0,0.0,0.0,0.0,0.0,0.0,0.0,0.0,0.0,0.0,0.0,0.0,0.0,0.0,0.0,0.0,0.0,0.0
73,15/03/2015 07:00,78.65,0.89,0.93,1.15,1.68,0.59,1.89,3.37,3.55,2.03,8.85,7.74,1.6,1.1325,0.0,1.69,1.36,2.0,2.05,2015-03-15 07:00:00,0.0,0.0,0.0,0.0,0.0,0.0,0.0,0.0,0.0,0.0,0.0,0.0,0.0,0.0,0.0,0.0,0.0,0.0,0.0
74,16/03/2015 07:00,78.63,0.81,0.88,1.11,1.64,0.56,1.83,2.45,2.86,1.92,8.95,7.78,1.61,1.1125,0.0,1.68,1.34,2.0,1.7,2015-03-16 07:00:00,0.0,0.0,0.0,0.0,0.0,0.0,0.0,0.0,0.0,0.0,0.0,0.0,0.0,0.0,0.0,0.0,0.0,0.0,0.0
75,17/03/2015 07:00,78.56,0.75,0.84,1.08,1.6,0.53,1.79,2.1,2.52,1.92,8.79,7.74,1.66,1.1125000000000003,0.0,1.68,1.32,1.9,1.4,2015-03-17 07:00:00,0.0,0.0,0.0,0.0,0.0,0.0,0.0,0.0,0.0,0.0,0.0,0.0,0.0,0.0,0.0,0.0,0.0,0.0,0.0
76,18/03/2015 07:00,78.5,0.69,0.82,1.05,1.57,0.51,1.74,1.93,2.37,1.87,8.71,7.82,1.64,1.11,0.0,1.68,1.3,1.98,1.3,2015-03-18 07:00:00,0.0,0.0,0.0,0.0,0.0,0.0,0.0,0.0,0.0,0.0,0.0,0.0,0.0,0.0,0.0,0.0,0.0,0.0,0.0
77,19/03/2015 07:00,78.44,0.64,0.79,1.03,1.55,0.49,1.69,1.84,2.26,1.85,8.61,7.48,1.56,1.0375,0.0,1.66,1.28,2.05,1.4,2015-03-19 07:00:00,0.0,0.0,0.0,0.0,0.0,0.0,0.0,0.0,0.0,0.0,0.0,0.0,0.0,0.0,0.0,0.0,0.0,0.0,0.0
78,20/03/2015 07:00,78.4,0.6,0.77,1.01,1.54,0.47,1.66,1.75,2.19,1.82,8.6,7.7,1.47,1.0474999999999999,0.0,1.58,1.27,2.05,1.25,2015-03-20 07:00:00,0.0,0.0,0.0,0.0,0.0,0.0,0.0,0.0,0.0,0.0,0.0,0.0,0.0,0.0,0.0,0.0,0.0,0.0,0.0
79,21/03/2015 07:00,78.25,0.66,0.79,1.0,1.53,0.46,1.63,1.71,2.18,1.79,8.58,7.58,1.49,1.01,0.0,1.65,1.25,2.0,1.75,2015-03-21 07:00:00,0.0,10.0,5.0,0.0,5.0,0.0,2.0,0.0,22.0,0.0,0.0,0.0,0.0,0.0,0.0,0.0,0.0,0.0,0.0
80,22/03/2015 07:00,78.24,0.97,0.79,0.97,1.51,0.44,1.6,1.66,2.07,1.76,8.44,7.6,1.62,1.0,0.0,1.7,1.24,2.16,2.4,2015-03-22 07:00:00,0.0,0.0,0.0,0.0,0.0,0.0,0.0,0.0,0.0,0.0,0.0,0.0,0.0,0.0,0.0,0.0,0.0,0.0,0.0
81,23/03/2015 07:00,78.15,0.79,0.77,0.96,1.5,0.44,1.57,1.63,2.01,1.74,8.4,7.65,1.8,0.9674999999999999,0.0,1.76,1.22,1.98,2.15,2015-03-23 07:00:00,0.0,0.0,0.0,0.0,0.0,0.0,0.0,0.0,0.0,0.0,0.0,0.0,0.0,0.0,0.0,0.0,0.0,0.0,0.0
82,24/03/2015 07:00,78.11,0.69,0.74,0.93,1.49,0.43,1.55,1.62,1.98,1.72,8.36,8.0,1.82,1.045,0.0,1.72,1.22,1.65,1.7,2015-03-24 07:00:00,0.0,0.0,0.0,0.0,0.0,0.0,0.0,0.0,0.0,0.0,0.0,0.0,0.0,0.0,0.0,0.0,0.0,0.0,0.0
83,25/03/2015 07:00,78.05,0.61,0.72,0.93,1.48,0.42,1.52,1.66,1.98,1.71,8.21,8.05,1.85,1.0150000000000001,0.0,1.64,1.21,1.54,1.75,2015-03-25 07:00:00,0.0,0.0,0.0,0.0,0.0,0.0,0.0,0.0,0.0,0.0,0.0,0.0,0.0,0.0,0.0,0.0,0.0,0.0,0.0
84,26/03/2015 07:00,77.96,0.56,0.72,0.92,1.47,0.41,1.51,1.65,1.98,1.69,8.2,7.95,1.86,1.0375,0.0,1.68,1.24,1.53,1.6,2015-03-26 07:00:00,2.0,1.0,1.0,0.0,0.0,0.0,0.0,5.0,0.0,0.0,0.0,2.0,0.0,0.0,5.0,12.0,8.0,8.0,14.0
85,27/03/2015 07:00,77.9,0.52,0.71,0.9,1.48,0.4,1.49,1.61,1.92,1.67,8.15,7.98,1.83,1.0075,0.0,1.7,1.26,1.7,1.75,2015-03-27 07:00:00,0.0,0.0,0.0,0.0,0.0,0.0,0.0,0.0,0.0,0.0,0.0,0.0,0.0,0.0,0.0,0.0,0.0,0.0,0.0
86,28/03/2015 07:00,77.88,0.5,0.7,0.89,1.48,0.4,1.47,1.58,1.87,1.66,8.07,7.96,1.83,1.045,0.0,1.69,1.28,1.48,1.35,2015-03-28 07:00:00,0.0,0.0,0.0,0.0,0.0,0.0,0.0,0.0,0.0,0.0,0.0,0.0,0.0,0.0,0.0,0.0,0.0,0.0,0.0
87,29/03/2015 07:00,77.8,0.48,0.7,0.87,1.47,0.39,1.44,1.56,1.83,1.64,7.98,7.9,1.88,1.0950000000000002,0.0,1.63,1.28,1.0,1.3,2015-03-29 07:00:00,0.0,0.0,0.0,0.0,0.0,0.0,0.0,0.0,0.0,0.0,0.0,0.0,0.0,0.0,0.0,0.0,0.0,0.0,0.0
88,30/03/2015 07:00,77.71,0.47,0.7,0.86,1.46,0.39,1.41,1.54,1.79,1.63,7.94,8.05,1.91,1.0950000000000002,0.0,1.53,1.28,0.85,1.05,2015-03-30 07:00:00,0.0,0.0,0.0,0.0,0.0,0.0,0.0,0.0,0.0,0.0,0.0,0.0,0.0,0.0,0.0,0.0,0.0,0.0,0.0
89,31/03/2015 07:00,77.63,0.46,0.7,0.87,1.46,0.39,1.4,1.52,1.77,1.61,7.89,8.0,1.86,1.0925,0.0,1.52,1.27,1.33,1.05,2015-03-31 07:00:00,0.0,0.0,0.0,2.0,5.0,3.0,2.0,0.0,0.0,0.0,0.0,0.0,0.0,0.0,0.0,0.0,0.0,0.0,0.0
90,01/04/2015 07:00,77.56,0.44,0.7,0.87,1.45,0.38,1.41,1.51,1.74,1.6,7.8,8.05,1.9,1.0950000000000002,0.0,1.58,1.26,0.6,1.36,2015-04-01 07:00:00,0.0,0.0,0.0,0.0,0.0,0.0,0.0,0.0,0.0,0.0,0.0,0.0,0.0,0.0,0.0,0.0,0.0,0.0,0.0
91,02/04/2015 07:00,77.5,0.43,0.69,0.89,1.45,0.37,1.41,1.5,1.72,1.6,7.73,8.05,1.92,1.1,0.0,1.59,1.25,1.23,1.05,2015-04-02 07:00:00,0.0,0.0,0.0,0.0,0.0,0.0,0.0,0.0,0.0,0.0,0.0,0.0,0.0,0.0,0.0,0.0,0.0,0.0,0.0
92,03/04/2015 07:00,77.44,0.41,0.69,0.9,1.44,0.38,1.44,1.49,1.71,1.59,7.66,8.05,1.9,1.1,0.0,1.52,1.24,1.2,1.0,2015-04-03 07:00:00,0.0,0.0,0.0,0.0,0.0,0.0,0.0,0.0,0.0,0.0,0.0,0.0,0.0,0.0,0.0,0.0,0.0,0.0,0.0
93,04/04/2015 07:00,77.38,0.4,0.69,0.91,1.44,0.37,1.45,1.48,1.69,1.59,7.6,8.02,1.83,1.0975000000000001,0.0,1.49,1.24,1.9,1.05,2015-04-04 07:00:00,0.0,0.0,0.0,0.0,0.0,0.0,0.0,0.0,0.0,0.0,0.0,0.0,0.0,0.0,0.0,0.0,0.0,0.0,0.0
94,05/04/2015 07:00,77.31,0.39,0.69,0.93,1.43,0.37,1.46,1.47,1.68,1.59,7.54,7.95,1.86,1.09,0.0,1.47,1.24,1.8,1.7,2015-04-05 07:00:00,0.0,0.0,0.0,0.0,0.0,0.0,0.0,0.0,0.0,0.0,0.0,0.0,0.0,0.0,0.0,0.0,0.0,0.0,0.0
95,06/04/2015 07:00,77.21,0.38,0.69,0.93,1.42,0.37,1.47,1.46,1.66,1.58,7.46,8.11,1.99,1.105,0.0,1.61,1.22,1.68,2.32,2015-04-06 07:00:00,0.0,0.0,0.0,0.0,0.0,0.0,0.0,0.0,0.0,0.0,0.0,0.0,0.0,0.0,0.0,0.0,0.0,0.0,0.0
96,07/04/2015 07:00,77.18,0.37,0.69,0.91,1.41,0.36,1.47,1.45,1.65,1.58,7.39,8.15,2.03,1.0699999999999998,0.0,1.6,1.21,1.7,1.75,2015-04-07 07:00:00,0.0,0.0,0.0,0.0,0.0,0.0,0.0,0.0,0.0,0.0,0.0,0.0,0.0,0.0,0.0,0.0,0.0,0.0,0.0
97,08/04/2015 07:00,77.11,0.36,0.68,0.88,1.4,0.36,1.45,1.44,1.64,1.59,7.29,8.15,1.96,1.07,0.0,1.58,1.2,1.3,1.45,2015-04-08 07:00:00,0.0,0.0,0.0,0.0,0.0,0.0,0.0,0.0,0.0,0.0,0.0,0.0,0.0,0.0,0.0,0.0,0.0,0.0,0.0
98,09/04/2015 07:00,77.03,0.38,0.68,0.87,1.41,0.35,1.41,1.43,1.6225,1.58,7.22,8.15,2.02,1.0825,0.0,1.56,1.19,0.81,1.2,2015-04-09 07:00:00,0.0,0.0,0.0,0.0,0.0,0.0,0.0,0.0,0.0,0.0,0.0,0.0,0.0,0.0,0.0,0.0,0.0,0.0,0.0
99,10/04/2015 07:00,76.94,0.38,0.7,0.86,1.41,0.35,1.39,1.43,1.62,1.57,7.15,8.16,1.99,1.0825,0.0,1.55,1.18,0.95,1.0,2015-04-10 07:00:00,0.0,0.0,0.0,0.0,0.0,0.0,0.0,0.0,0.0,0.0,0.0,0.0,0.0,0.0,0.0,0.0,0.0,0.0,0.0
100,11/04/2015 07:00,76.86,0.36,0.71,0.87,1.4,0.34,1.39,1.42,1.62,1.56,7.11,8.12,1.96,1.0675,0.0,1.49,1.19,0.97,1.35,2015-04-11 07:00:00,0.0,0.0,0.0,0.0,0.0,0.0,0.0,5.0,0.0,0.0,0.0,0.0,0.0,0.0,0.0,1.0,0.0,6.0,20.0
101,12/04/2015 07:00,76.81,0.35,0.71,0.87,1.39,0.34,1.39,1.42,1.61,1.55,7.01,8.1,1.9,1.07,0.0,1.53,1.24,1.0,1.7,2015-04-12 07:00:00,2.0,0.0,0.0,0.0,0.0,0.0,0.0,10.0,0.0,0.0,0.0,4.0,1.0,5.0,0.0,4.0,10.0,12.0,16.0
102,13/04/2015 07:00,76.75,0.35,0.7,0.86,1.38,0.34,1.39,1.42,1.61,1.53,6.92,8.0,1.83,1.0675,0.0,1.52,1.25,1.15,1.25,2015-04-13 07:00:00,0.0,0.0,0.0,0.0,0.0,0.0,0.0,0.0,0.0,0.0,0.0,0.0,0.0,0.0,0.0,0.0,0.0,0.0,0.0
103,14/04/2015 07:00,76.68,0.34,0.69,0.84,1.38,0.33,1.37,1.42,1.6,1.53,6.85,7.93,1.75,0.9375,0.0,1.47,1.24,0.35,0.8,2015-04-14 07:00:00,0.0,0.0,0.0,0.0,0.0,0.0,0.0,0.0,0.0,0.0,0.0,0.0,0.0,0.0,0.0,0.0,0.0,0.0,0.0
104,15/04/2015 07:00,76.56,0.33,0.67,0.82,1.37,0.33,1.35,1.42,1.6,1.53,6.79,7.8,1.67,0.935,0.0,1.46,1.24,0.85,1.45,2015-04-15 07:00:00,0.0,0.0,0.0,0.0,0.0,0.0,0.0,0.0,0.0,0.0,0.0,0.0,0.0,0.0,0.0,0.0,0.0,0.0,0.0
105,16/04/2015 07:00,76.53,0.33,0.67,0.81,1.36,0.32,1.32,1.41,1.59,1.52,6.7,7.8,1.68,1.0574999999999999,0.0,1.48,1.24,1.6,2.0,2015-04-16 07:00:00,0.0,0.0,0.0,0.0,0.0,0.0,0.0,0.0,0.0,0.0,0.0,0.0,0.0,0.0,0.0,0.0,0.0,0.0,0.0
106,17/04/2015 07:00,76.4,0.32,0.66,0.79,1.35,0.33,1.29,1.4,1.58,1.51,6.66,7.85,1.66,0.88,0.0,1.43,1.25,1.2,1.5,2015-04-17 07:00:00,5.0,0.0,0.0,0.0,0.0,0.0,0.0,20.0,0.0,0.0,0.0,4.0,2.0,0.0,4.0,8.0,25.0,33.0,34.0
107,18/04/2015 07:00,76.38,0.41,0.68,0.78,1.35,0.34,1.27,1.42,1.59,1.51,6.6,7.74,1.66,1.0375,0.0,1.52,1.4024999999999999,0.78,0.85,2015-04-18 07:00:00,19.0,15.0,16.0,5.0,10.0,6.0,3.0,19.25,14.0,19.0,26.0,23.0,24.0,20.0,26.0,26.0,28.0,7.0,14.0
108,19/04/2015 07:00,76.4,0.47,0.66,0.76,1.34,0.35,1.25,1.41,1.58,1.49,6.6,7.65,1.62,0.9450000000000001,0.0,1.5,1.43,0.75,0.75,2015-04-19 07:00:00,0.0,0.0,0.0,0.0,0.0,0.0,0.0,0.0,0.0,0.0,0.0,0.0,0.0,0.0,0.0,0.0,0.0,0.0,0.0
109,20/04/2015 07:00,76.4,0.5,0.67,0.74,1.34,0.34,1.24,1.41,1.58,1.48,6.62,7.63,1.63,0.905,0.0,1.51,1.46,0.55,0.9,2015-04-20 07:00:00,0.0,0.0,0.0,0.0,0.0,0.0,0.0,0.0,0.0,0.0,0.0,0.0,0.0,0.0,0.0,0.0,0.0,0.0,0.0
110,21/04/2015 07:00,76.4,0.45,0.66,0.74,1.33,0.34,1.22,1.41,1.58,1.47,6.59,7.65,1.61,0.9650000000000001,0.0,1.59,1.42,1.2,1.53,2015-04-21 07:00:00,0.0,0.0,0.0,0.0,0.0,0.0,0.0,0.0,0.0,0.0,0.0,0.0,0.0,0.0,0.0,0.0,0.0,0.0,0.0
111,22/04/2015 07:00,76.38,0.41,0.66,0.73,1.33,0.34,1.2,1.42,1.57,1.46,6.58,7.67,1.61,0.9650000000000001,0.0,1.63,1.4,1.45,1.5,2015-04-22 07:00:00,0.0,0.0,0.0,0.0,0.0,0.0,0.0,0.0,0.0,0.0,0.0,0.0,0.0,0.0,0.0,0.0,0.0,0.0,0.0
112,23/04/2015 07:00,76.38,0.38,0.66,0.72,1.33,0.34,1.19,1.43,1.58,1.4575,6.58,7.6,1.6,0.7725,0.0,1.63,1.38,0.75,1.15,2015-04-23 07:00:00,0.0,0.0,0.0,0.0,0.0,0.0,0.0,0.0,0.0,0.0,0.0,0.0,0.0,0.0,0.0,0.0,0.0,0.0,0.0
113,24/04/2015 07:00,76.38,0.35,0.64,0.71,1.33,0.34,1.12,1.44,1.59,1.43,6.58,7.61,1.59,0.6225,0.0,1.62,1.355,0.4,1.0,2015-04-24 07:00:00,0.0,0.0,0.0,0.0,0.0,0.0,0.0,0.0,0.0,0.0,0.0,0.0,0.0,0.0,0.0,0.0,0.0,0.0,0.0
114,25/04/2015 07:00,76.38,0.34,0.65,0.71,1.32,0.34,1.11,1.44,1.59,1.4775,6.6,7.59,1.59,0.7725,0.0,1.63,1.34,0.58,1.05,2015-04-25 07:00:00,0.0,0.0,0.0,0.0,0.0,0.0,0.0,0.0,0.0,0.0,0.0,0.0,0.0,0.0,0.0,0.0,0.0,0.0,0.0
115,26/04/2015 07:00,76.38,0.32,0.65,0.7,1.32,0.34,1.1,1.44,1.59,1.455,6.58,7.6,1.58,0.7725,0.0,1.6,1.32,0.5,1.05,2015-04-26 07:00:00,0.0,0.0,0.0,0.0,0.0,0.0,0.0,0.0,0.0,0.0,0.0,0.0,0.0,0.0,0.0,0.0,0.0,0.0,0.0
116,27/04/2015 07:00,76.38,0.32,0.65,0.69,1.31,0.34,1.11,1.44,1.58,1.4500000000000002,6.57,7.6,1.59,0.6225,0.0,1.57,1.3,0.45,0.9,2015-04-27 07:00:00,0.0,0.0,0.0,0.0,0.0,0.0,0.0,0.0,0.0,0.0,0.0,0.0,0.0,0.0,0.0,0.0,0.0,0.0,0.0
117,28/04/2015 07:00,76.34,0.31,0.65,0.69,1.31,0.34,1.1,1.41,1.57,1.41,6.57,7.55,1.53,0.9650000000000001,0.0,1.54,1.29,0.9,1.5,2015-04-28 07:00:00,0.0,0.0,0.0,0.0,0.0,0.0,0.0,0.0,0.0,0.0,0.0,0.0,0.0,0.0,0.0,0.0,0.0,0.0,0.0
118,29/04/2015 07:00,76.4,0.31,0.64,0.68,1.31,0.34,1.08,1.4,1.55,1.42,6.52,7.55,1.51,0.51,0.0,1.44,1.28,1.0,1.45,2015-04-29 07:00:00,0.0,0.0,0.0,0.0,0.0,0.0,0.0,0.0,0.0,0.0,0.0,0.0,0.0,0.0,0.0,0.0,0.0,0.0,0.0
119,30/04/2015 07:00,76.38,0.31,0.64,0.68,1.3,0.33,1.07,1.39,1.54,1.4,6.52,7.6,1.52,0.51,0.0,1.42,1.2,0.35,0.8,2015-04-30 07:00:00,2.0,1.0,0.0,1.0,0.0,0.0,1.0,2.0,0.0,1.0,1.0,1.0,0.0,1.0,9.0,5.0,2.0,2.0,4.0
120,01/05/2015 07:00,76.38,0.31,0.64,0.67,1.3,0.33,1.06,1.38,1.53,1.4,6.56,7.6,1.51,0.51,0.0,1.39,1.2,0.1,0.5,2015-05-01 07:00:00,0.0,0.0,0.0,0.0,0.0,0.0,0.0,0.0,0.0,0.0,0.0,0.0,0.0,0.0,0.0,0.0,0.0,0.0,0.0
121,02/05/2015 07:00,76.4,0.32,0.64,0.67,1.3,0.33,1.05,1.37,1.53,1.36,6.48,7.58,1.56,0.51,0.0,1.3,1.23,0.2,0.7,2015-05-02 07:00:00,12.0,8.0,4.0,0.0,1.0,1.0,0.0,30.0,0.0,0.0,14.0,30.0,20.0,7.0,15.0,21.0,22.0,28.0,47.0
122,03/05/2015 07:00,76.36,1.44,0.95,0.69,1.36,0.38,1.08,1.44,1.58,1.42,6.63,7.63,1.62,0.52,0.0,1.36,1.44,0.35,0.75,2015-05-03 07:00:00,24.0,60.0,55.0,48.0,42.0,37.0,30.0,10.0,65.0,25.0,28.0,38.0,30.0,18.0,17.0,15.0,11.0,5.0,19.0
123,04/05/2015 07:00,76.36,2.36,1.18,0.7,1.36,0.39,1.08,1.46,1.6,1.4,6.61,7.63,1.61,0.52,0.0,1.48,1.46,0.8,1.25,2015-05-04 07:00:00,0.0,0.0,0.0,0.0,0.0,0.0,0.0,0.0,0.0,0.0,0.0,0.0,0.0,0.0,0.0,0.0,0.0,0.0,0.0
124,05/05/2015 07:00,76.38,2.38,0.91,0.71,1.57,0.39,1.09,1.51,1.61,1.4,6.57,7.67,1.6,0.52,0.0,1.54,1.48,0.8,1.25,2015-05-05 07:00:00,0.0,0.0,0.0,0.0,0.0,0.0,0.0,0.0,0.0,0.0,0.0,0.0,0.0,0.0,0.0,0.0,0.0,0.0,0.0
125,06/05/2015 07:00,76.36,1.72,0.89,0.71,1.72,0.39,1.1,1.85,1.89,1.41,6.55,7.63,1.64,1.2425,0.0,1.55,1.45,1.05,1.5,2015-05-06 07:00:00,0.0,0.0,0.0,0.0,0.0,0.0,0.0,0.0,0.0,0.0,0.0,0.0,0.0,0.0,0.0,0.0,0.0,0.0,0.0
126,07/05/2015 07:00,76.38,1.31,0.93,0.72,1.63,0.41,1.1,2.11,2.25,1.4,6.59,7.63,1.64,1.2075,0.0,1.62,1.43,1.6,2.0,2015-05-07 07:00:00,0.0,0.0,0.0,0.0,0.0,0.0,0.0,0.0,0.0,0.0,0.0,0.0,0.0,0.0,0.0,0.0,0.0,0.0,0.0
127,08/05/2015 07:00,76.4,1.01,0.96,0.74,1.54,0.42,1.12,2.19,2.35,1.38,6.55,7.65,1.61,1.2850000000000001,0.0,1.58,1.41,0.9,1.45,2015-05-08 07:00:00,0.0,0.0,0.0,0.0,0.0,0.0,0.0,0.0,0.0,0.0,0.0,0.0,0.0,0.0,0.0,0.0,0.0,0.0,0.0
128,09/05/2015 07:00,76.38,0.81,0.93,0.82,1.53,0.43,1.14,2.15,2.34,1.39,6.55,7.64,1.63,1.2675,0.0,1.5,1.38,0.58,1.35,2015-05-09 07:00:00,0.0,0.0,0.0,0.0,0.0,0.0,0.0,0.0,0.0,0.0,0.0,0.0,0.0,0.0,0.0,0.0,0.0,0.0,0.0
129,10/05/2015 07:00,76.38,0.7,0.9,0.87,1.55,0.44,1.25,2.04,2.26,1.39,6.57,7.63,1.63,1.24,0.0,1.48,1.36,0.83,1.45,2015-05-10 07:00:00,0.0,0.0,0.0,0.0,0.0,0.0,1.0,4.25,0.0,0.0,0.0,0.0,0.0,0.0,0.0,0.0,0.0,7.0,3.0
130,11/05/2015 07:00,76.38,0.75,0.89,0.88,1.54,0.46,1.34,1.93,2.16,1.4,6.57,7.64,1.63,1.24,0.0,1.49,1.34,0.83,1.45,2015-05-11 07:00:00,1.0,18.0,20.0,3.0,5.0,2.0,0.0,0.0,0.0,0.0,0.0,1.0,0.0,0.5,0.0,0.0,2.0,3.0,0.0
131,12/05/2015 07:00,76.4,1.01,0.83,0.86,1.53,0.47,1.35,1.85,2.06,1.45,6.57,7.65,1.62,1.26,0.0,1.49,1.32,0.5,1.0,2015-05-12 07:00:00,0.0,0.0,0.0,0.0,0.0,0.0,0.0,0.0,0.0,0.0,0.0,0.0,0.0,0.0,0.0,0.0,0.0,0.0,0.0
132,13/05/2015 07:00,76.4,1.23,0.8,0.84,1.52,0.48,1.31,1.82,2.01,1.49,6.57,7.65,1.62,1.26,0.0,1.47,1.31,0.4,0.85,2015-05-13 07:00:00,0.0,0.0,0.0,0.0,0.0,0.0,0.0,0.0,0.0,0.0,0.0,0.0,0.0,0.0,0.0,0.0,0.0,0.0,0.0
133,14/05/2015 07:00,76.4,1.15,0.81,0.82,1.54,0.48,1.28,1.79,1.98,1.49,6.59,7.64,1.62,1.26,0.0,1.42,1.3,0.35,0.8,2015-05-14 07:00:00,0.0,0.0,0.0,0.0,0.0,0.0,0.0,0.0,0.0,0.0,0.0,0.0,0.0,0.0,0.0,0.0,0.0,0.0,0.0
134,15/05/2015 07:00,76.4,1.0,0.85,0.81,1.53,0.47,1.25,1.85,2.01,1.475,6.6,7.63,1.61,1.2349999999999999,0.0,1.38,1.29,0.35,0.9,2015-05-15 07:00:00,0.0,0.0,0.0,0.0,0.0,0.0,0.0,0.0,0.0,0.0,0.0,0.0,0.0,0.0,0.0,0.0,0.0,0.0,0.0
135,16/05/2015 07:00,76.43,0.85,0.87,0.85,1.5,0.47,1.24,1.91,2.08,1.47,6.6,7.64,1.63,1.2349999999999999,0.0,1.38,1.28,0.5,0.93,2015-05-16 07:00:00,0.0,0.0,0.0,0.0,0.0,0.0,0.0,0.0,0.0,0.0,0.0,0.0,0.0,0.0,0.0,0.0,0.0,0.0,0.0
136,17/05/2015 07:00,76.44,0.74,0.86,0.88,1.47,0.47,1.29,1.9,2.09,1.45,6.62,7.63,1.6,1.2449999999999999,0.0,1.36,1.27,0.65,1.05,2015-05-17 07:00:00,0.0,0.0,0.0,0.0,0.0,0.0,0.0,0.0,0.0,0.0,0.0,0.0,0.0,0.0,0.0,0.0,0.0,0.0,0.0
137,18/05/2015 07:00,76.44,0.68,0.83,0.91,1.47,0.47,1.35,1.86,2.06,1.45,6.6,7.62,1.61,1.18,0.0,1.39,1.26,0.5,0.85,2015-05-18 07:00:00,0.0,0.0,0.0,0.0,0.0,0.0,0.0,0.0,0.0,0.0,0.0,0.0,0.0,0.0,0.0,0.0,0.0,0.0,0.0
138,19/05/2015 07:00,76.44,0.62,0.79,0.91,1.47,0.47,1.39,1.81,2.0,1.46,6.59,7.62,1.61,1.08,0.0,1.37,1.26,0.67,1.09,2015-05-19 07:00:00,0.0,0.0,0.0,0.0,0.0,0.0,0.0,0.0,0.0,0.0,0.0,0.0,0.0,0.0,0.0,0.0,0.0,0.0,0.0
139,20/05/2015 07:00,76.44,0.59,0.77,0.88,1.47,0.47,1.37,1.74,1.93,1.5,6.61,7.62,1.61,1.0799999999999998,0.0,1.35,1.25,0.6,1.05,2015-05-20 07:00:00,0.0,0.0,0.0,0.0,0.0,0.0,0.0,0.0,0.0,0.0,0.0,0.0,0.0,0.0,0.0,0.0,0.0,0.0,0.0
140,21/05/2015 07:00,76.44,0.56,0.75,0.85,1.46,0.46,1.33,1.69,1.88,1.51,6.61,7.6,1.61,1.105,0.0,1.31,1.25,0.6,1.0,2015-05-21 07:00:00,0.0,0.0,0.0,0.0,0.0,0.0,0.0,0.0,0.0,0.0,0.0,0.0,0.0,0.0,0.0,0.0,0.0,0.0,0.0
141,22/05/2015 07:00,76.44,0.54,0.74,0.82,1.45,0.46,1.29,1.65,1.83,1.51,6.62,7.62,1.6,1.04,0.0,1.29,1.25,0.6,0.78,2015-05-22 07:00:00,0.0,0.0,0.0,0.0,0.0,0.0,0.0,0.0,0.0,0.0,0.0,0.0,0.0,0.0,0.0,0.0,0.0,0.0,0.0
142,23/05/2015 07:00,76.43,0.52,0.73,0.8,1.43,0.45,1.24,1.61,1.78,1.5,6.63,7.65,1.61,0.96,0.0,1.2,1.24,0.57,1.0,2015-05-23 07:00:00,5.0,1.0,3.0,0.0,1.0,2.0,2.0,0.0,0.0,0.0,17.0,4.0,1.0,5.0,7.0,17.0,0.0,0.0,0.0
143,24/05/2015 07:00,76.5,1.09,0.83,0.8,1.47,0.5,1.25,1.63,1.79,1.51,6.69,7.67,1.64,1.07,0.0,1.36,1.24,1.0,1.7,2015-05-24 07:00:00,17.0,21.0,24.0,37.0,24.0,35.0,31.0,0.0,27.0,50.0,25.0,16.0,30.0,20.0,10.0,5.0,0.0,0.0,0.0
144,25/05/2015 07:00,76.5,1.76,0.93,0.79,1.47,0.5,1.22,1.62,1.77,1.49,6.69,7.66,1.64,1.17,0.0,1.49,1.23,1.2,1.62,2015-05-25 07:00:00,0.0,0.0,0.0,0.0,0.0,0.0,0.0,0.0,0.0,0.0,0.0,0.0,0.0,0.0,0.0,0.0,0.0,0.0,0.0
145,26/05/2015 07:00,76.5,1.91,0.88,0.8,1.66,0.51,1.21,1.65,1.7650000000000001,1.5,6.69,7.66,1.64,1.21,0.0,1.54,1.22,0.8,1.3,2015-05-26 07:00:00,0.0,0.0,0.0,0.0,0.0,0.0,0.0,0.0,0.0,0.0,0.0,0.0,0.0,0.0,0.0,0.0,0.0,0.0,0.0
146,27/05/2015 07:00,76.5,1.59,0.85,0.8,1.7,0.51,1.22,1.78,1.88,1.52,6.7,7.64,1.64,1.27,0.0,1.54,1.22,0.88,1.45,2015-05-27 07:00:00,0.0,0.0,0.0,0.0,0.0,0.0,0.0,0.0,0.0,0.0,0.0,0.0,0.0,0.0,0.0,0.0,0.0,0.0,0.0
147,28/05/2015 07:00,76.49,1.32,0.88,0.8,1.64,0.51,1.23,2.01,2.11,1.5,6.7,7.64,1.64,1.32,0.0,1.57,1.21,1.2,1.37,2015-05-28 07:00:00,0.0,0.0,0.0,5.0,0.0,2.0,4.0,0.0,0.0,0.0,0.0,1.0,0.0,2.0,0.0,0.0,0.0,0.0,0.0
148,29/05/2015 07:00,76.5,1.09,0.86,0.81,1.56,0.5,1.24,2.13,2.27,1.48,6.7,7.66,1.62,1.28,0.0,1.56,1.21,0.6,1.0,2015-05-29 07:00:00,0.0,0.0,0.0,0.0,0.0,0.0,0.0,0.0,0.0,0.0,0.0,0.0,0.0,0.0,0.0,0.0,0.0,0.0,0.0
149,30/05/2015 07:00,76.49,0.94,0.85,0.82,1.52,0.49,1.25,2.13,2.3,1.47,6.7,7.57,1.52,1.25,0.0,1.54,1.21,0.4,1.0,2015-05-30 07:00:00,0.0,0.0,0.0,0.0,0.0,0.0,0.0,0.0,0.0,0.0,0.0,0.0,0.0,0.0,0.0,0.0,0.0,0.0,0.0
150,31/05/2015 07:00,76.46,0.84,0.82,0.82,1.51,0.49,1.25,2.05,2.24,1.45,6.71,7.6,1.57,1.25,0.0,1.57,1.21,0.4,1.05,2015-05-31 07:00:00,0.0,0.0,0.0,0.0,0.0,0.0,0.0,0.0,0.0,0.0,0.0,0.0,0.0,0.0,0.0,0.0,0.0,0.0,1.0
151,01/06/2015 07:00,76.49,0.77,0.8,0.82,1.5,0.48,1.26,1.94,2.16,1.45,6.68,7.62,1.59,1.29,0.0,1.67,1.21,0.75,1.1,2015-06-01 07:00:00,0.0,0.0,0.0,0.0,0.0,0.0,0.0,0.0,0.0,0.0,0.0,0.0,0.0,0.0,0.0,0.0,0.0,0.0,0.0
152,02/06/2015 07:00,76.5,0.71,0.78,0.82,1.48,0.48,1.25,1.85,2.05,1.45,6.68,7.67,1.57,1.26,0.0,1.64,1.21,0.55,0.87,2015-06-02 07:00:00,0.0,0.0,0.0,0.0,0.0,0.0,0.0,0.0,0.0,0.0,0.0,0.0,0.0,0.0,0.0,0.0,0.0,0.0,0.0
153,03/06/2015 07:00,76.49,0.66,0.76,0.88,1.47,0.48,1.25,1.79,1.97,1.45,6.65,7.68,1.53,1.18,0.0,1.54,1.21,0.61,0.78,2015-06-03 07:00:00,0.0,0.0,0.0,0.0,0.0,0.0,0.0,0.0,0.0,0.0,0.0,0.0,0.0,0.0,0.0,0.0,0.0,0.0,0.0
154,04/06/2015 07:00,76.46,0.63,0.75,0.94,1.45,0.47,1.35,1.72,1.91,1.45,6.65,7.6,1.55,1.24,0.0,1.59,1.21,0.37,0.75,2015-06-04 07:00:00,0.0,0.0,0.0,0.0,0.0,0.0,0.0,0.0,0.0,0.0,0.0,0.0,0.0,0.0,0.0,0.0,0.0,0.0,0.0
155,05/06/2015 07:00,76.49,0.6,0.74,0.96,1.44,0.46,1.44,1.68,1.85,1.45,6.65,7.64,1.57,1.14,0.0,1.48,1.21,0.9,1.25,2015-06-05 07:00:00,0.0,0.0,0.0,0.0,0.0,0.0,1.0,0.0,0.0,0.0,0.0,0.0,0.0,0.0,0.0,0.0,0.0,0.0,0.0
156,06/06/2015 07:00,76.44,0.6,0.74,1.95,1.49,0.48,1.48,1.68,1.83,1.54,6.66,7.64,1.55,1.01,0.0,1.31,1.22,0.9,1.25,2015-06-06 07:00:00,1.0,1.0,0.0,50.0,24.0,21.0,15.0,0.0,18.0,10.0,4.0,0.0,1.0,8.0,0.0,0.0,0.0,0.0,0.0
157,07/06/2015 07:00,76.44,0.59,0.75,2.76,1.56,0.48,2.36,1.7,1.86,1.59,6.67,7.6,1.61,1.06,0.0,1.38,1.22,1.35,0.95,2015-06-07 07:00:00,0.0,0.0,0.0,0.0,0.0,0.0,0.0,0.0,0.0,0.0,0.0,0.0,0.0,2.0,3.0,0.0,0.0,0.0,0.0
158,08/06/2015 07:00,76.4,0.59,0.75,2.6,1.69,0.49,2.97,1.66,1.82,1.72,6.6,7.63,1.56,1.12,0.0,1.46,1.21,0.98,1.58,2015-06-08 07:00:00,0.0,1.0,3.0,0.0,0.0,0.0,0.0,0.0,0.0,0.0,0.0,0.0,0.0,0.0,0.0,0.0,0.0,0.0,0.0
159,09/06/2015 07:00,76.44,1.3,0.84,2.76,2.11,0.61,3.04,1.69,1.83,2.42,6.55,7.6,1.54,1.08,0.0,1.42,1.21,1.2,1.2,2015-06-09 07:00:00,0.0,41.0,42.0,25.0,32.0,30.0,18.0,0.0,28.0,15.0,2.0,0.0,0.0,0.0,0.0,0.0,0.0,0.0,0.0
160,10/06/2015 07:00,76.34,2.63,1.84,3.34,2.34,0.78,3.16,1.91,1.99,2.71,6.58,7.64,1.6,1.09,0.0,1.42,1.21,1.25,1.54,2015-06-10 07:00:00,1.0,38.0,46.0,21.0,8.0,5.0,7.0,0.0,5.0,5.0,10.0,2.0,0.0,2.0,0.0,0.0,0.0,0.0,0.0
161,11/06/2015 07:00,76.34,4.2,2.31,3.93,3.0,1.16,3.49,2.22,2.28,2.8,6.59,7.61,1.53,1.2,0.0,1.52,1.2,1.2,1.53,2015-06-11 07:00:00,0.0,9.0,9.0,9.0,1.0,1.0,1.0,0.0,0.0,0.0,0.0,0.0,0.0,0.0,0.0,0.0,0.0,0.0,0.0
162,12/06/2015 07:00,76.3,4.8,2.12,4.43,3.66,1.79,3.88,2.97,2.78,2.97,6.5,7.6,1.52,1.3,0.0,1.62,1.19,1.25,1.45,2015-06-12 07:00:00,0.0,0.0,0.0,0.0,0.0,0.0,0.0,0.0,0.0,0.0,0.0,0.0,0.0,0.0,0.0,0.0,0.0,0.0,0.0
163,13/06/2015 07:00,76.3,5.57,2.05,4.73,4.11,2.15,4.26,3.61,3.27,3.23,6.49,7.63,1.53,1.27,0.0,1.59,1.19,1.15,1.3,2015-06-13 07:00:00,0.0,0.0,0.0,0.0,0.0,0.0,0.0,0.0,0.0,0.0,0.0,0.0,0.0,0.0,0.0,0.0,0.0,0.0,0.0
164,14/06/2015 07:00,76.3,5.8,2.22,5.06,4.99,2.18,4.57,4.12,3.67,3.51,6.53,7.55,1.53,1.2,0.0,1.53,1.19,1.1,1.0,2015-06-14 07:00:00,3.0,0.0,0.0,0.0,0.0,0.0,0.0,0.0,1.0,3.0,6.0,4.0,0.0,1.0,0.0,0.0,0.0,0.0,0.0
165,15/06/2015 07:00,76.3,5.59,2.36,5.88,5.52,2.05,4.83,4.67,4.13,3.76,6.58,7.6,1.54,1.27,0.0,1.61,1.19,1.1,1.1,2015-06-15 07:00:00,0.0,0.0,0.0,0.0,0.0,0.0,0.0,0.0,0.0,0.0,0.0,0.0,0.0,0.0,0.0,0.0,0.0,0.0,0.0
166,16/06/2015 07:00,76.34,5.11,2.32,6.91,5.43,1.84,5.27,5.14,4.49,3.97,6.55,7.58,1.51,1.28,0.0,1.6,1.19,0.6,1.05,2015-06-16 07:00:00,0.0,0.0,0.0,0.0,0.0,0.0,0.0,0.0,0.0,0.0,0.0,0.0,0.0,0.0,0.0,0.0,0.0,0.0,0.0
167,17/06/2015 07:00,76.4,4.12,2.06,7.01,5.17,1.62,5.86,5.44,4.77,4.13,6.64,7.52,1.54,1.28,0.0,1.6,1.19,0.6,0.95,2015-06-17 07:00:00,0.0,0.0,0.0,0.0,0.0,0.0,0.0,0.0,0.0,0.0,0.0,0.0,0.0,0.0,0.0,0.0,0.0,0.0,0.0
168,18/06/2015 07:00,76.4,2.68,1.66,6.81,4.57,1.46,6.37,5.63,4.94,4.48,6.7,7.55,1.57,1.36,0.0,1.7,1.19,1.0,1.45,2015-06-18 07:00:00,0.0,0.0,0.0,0.0,0.0,0.0,0.0,0.0,0.0,0.0,0.0,0.0,0.0,0.0,0.0,0.0,0.0,0.0,0.0
169,19/06/2015 07:00,76.44,1.56,1.32,6.51,3.66,1.32,6.74,5.49,4.91,4.81,6.67,7.55,1.42,1.45,0.0,1.78,1.17,1.7,1.9,2015-06-19 07:00:00,0.0,0.0,0.0,0.0,0.0,0.0,0.0,0.0,0.0,0.0,0.0,0.0,0.0,0.0,0.0,0.0,0.0,0.0,0.0
170,20/06/2015 07:00,76.44,1.21,1.1,6.2,2.89,1.21,6.98,5.22,4.69,5.14,6.62,7.57,1.37,1.35,0.0,1.67,1.18,1.4,1.45,2015-06-20 07:00:00,0.0,0.0,0.0,0.0,0.0,0.0,0.0,0.0,0.0,0.0,0.0,0.0,0.0,0.0,0.0,0.0,0.0,0.0,0.0
171,21/06/2015 07:00,76.43,1.1,0.98,5.86,2.35,1.12,7.01,4.5,4.32,5.45,6.64,7.58,1.4,1.33,0.0,1.63,1.18,1.2,1.15,2015-06-21 07:00:00,0.0,0.0,0.0,0.0,0.0,0.0,0.0,0.0,0.0,0.0,0.0,0.0,0.0,0.0,0.0,0.0,0.0,0.0,0.0
172,22/06/2015 07:00,76.4,1.02,0.92,5.32,2.05,1.04,6.87,3.34,3.63,5.68,6.64,7.56,1.41,1.29,0.0,1.6,1.18,1.3,1.25,2015-06-22 07:00:00,0.0,0.0,0.0,0.0,0.0,0.0,0.0,0.0,0.0,0.0,0.0,0.0,0.0,0.0,0.0,0.0,0.0,0.0,0.0
173,23/06/2015 07:00,76.4,1.0,0.9,4.27,1.91,0.96,6.57,2.5,3.0,5.84,6.6,7.49,1.35,1.4,0.0,1.7,1.18,1.35,1.2,2015-06-23 07:00:00,0.0,10.0,8.0,0.0,0.0,0.0,0.0,0.0,0.0,0.0,0.0,0.0,0.0,0.0,0.0,0.0,0.0,0.0,0.0
174,24/06/2015 07:00,76.38,0.98,0.86,2.9,1.82,0.91,5.97,2.27,2.82,5.91,6.55,7.55,1.43,1.4,0.0,1.71,1.18,1.72,1.75,2015-06-24 07:00:00,0.0,0.0,0.0,0.0,0.0,0.0,0.0,0.0,0.0,0.0,0.0,0.0,0.0,0.0,0.0,0.0,0.0,0.0,0.0
175,25/06/2015 07:00,76.38,0.98,0.86,1.98,1.78,0.86,4.95,2.14,2.75,5.1450000000000005,6.49,7.59,1.5,1.31,0.0,1.59,1.19,1.32,1.3,2015-06-25 07:00:00,0.0,0.0,0.0,0.0,0.0,0.0,0.0,0.0,0.0,0.0,0.0,0.0,0.0,0.0,0.0,0.0,0.0,0.0,0.0
176,26/06/2015 07:00,76.34,0.96,0.85,2.7199999999999998,1.77,0.81,3.6,1.515,1.6099999999999999,1.67,6.52,7.62,1.51,1.04,0.0,1.53,1.19,1.05,1.11,2015-06-26 07:00:00,0.0,0.0,0.0,0.0,0.0,0.0,0.0,0.0,0.0,0.0,0.0,0.0,0.0,0.0,0.0,0.0,0.0,0.0,0.0
177,27/06/2015 07:00,76.34,0.91,0.84,1.58,1.74,0.78,2.6,2.0,2.53,4.72,6.54,7.58,1.46,0.99,0.0,1.46,1.2,1.0,1.05,2015-06-27 07:00:00,0.0,0.0,0.0,0.0,0.0,0.0,0.0,0.0,0.0,0.0,0.0,0.0,0.0,0.0,0.0,0.0,0.0,0.0,0.0
178,28/06/2015 07:00,76.38,0.86,0.83,1.49,1.69,0.75,2.26,1.96,2.25,3.51,6.61,7.48,1.5,0.89,0.0,1.35,1.2,0.75,1.0,2015-06-28 07:00:00,0.0,0.0,0.0,0.0,0.0,0.0,0.0,0.0,0.0,0.0,0.0,0.0,0.0,0.0,0.0,0.0,0.0,3.0,2.0
179,29/06/2015 07:00,76.4,0.81,0.83,1.42,1.66,0.73,2.12,1.93,2.07,2.7,6.59,7.55,1.43,0.81,0.0,1.27,1.22,0.87,1.0,2015-06-29 07:00:00,0.0,0.0,0.0,0.0,0.0,0.0,0.0,15.0,0.0,0.0,0.0,0.0,0.0,0.0,0.0,0.0,12.0,15.0,14.0
180,30/06/2015 07:00,76.4,2.41,1.61,1.51,1.69,0.75,2.07,1.93,2.04,2.42,6.62,7.5,1.47,0.76,0.0,1.27,1.33,0.71,1.18,2015-06-30 07:00:00,17.0,36.0,50.0,42.0,10.0,35.0,30.0,10.0,52.0,32.0,12.0,18.0,20.0,12.0,25.0,15.0,18.0,15.0,12.0
181,01/07/2015 07:00,76.43,3.38,1.8,1.83,1.97,0.75,2.24,1.98,2.03,2.29,6.6,7.37,1.35,0.89,0.0,1.43,1.33,1.15,1.58,2015-07-01 07:00:00,0.0,0.0,0.0,0.0,0.0,0.0,0.0,0.0,0.0,0.0,0.0,0.0,0.0,0.0,0.0,0.0,0.0,0.0,0.0
182,02/07/2015 07:00,76.44,4.21,1.59,1.97,3.21,1.01,2.48,2.56,2.38,2.27,6.56,7.34,1.3,0.92,0.0,1.46,1.34,1.68,1.7,2015-07-02 07:00:00,0.0,0.0,0.0,0.0,0.0,0.0,1.0,0.0,0.0,0.0,0.0,0.0,0.0,0.0,0.0,0.0,0.0,0.0,0.0
183,03/07/2015 07:00,76.4,4.54,1.5,2.23,3.63,1.35,2.54,3.17,2.89,2.4,6.62,7.4,1.38,0.84,0.0,1.4,1.33,1.52,1.6,2015-07-03 07:00:00,0.0,12.0,7.0,7.0,5.0,6.0,1.0,0.0,0.0,0.0,0.0,0.0,0.0,0.0,0.0,0.0,0.0,0.0,0.0
184,04/07/2015 07:00,76.4,4.36,1.57,2.62,3.89,1.52,2.71,3.62,3.25,2.49,6.65,7.35,1.38,0.96,0.0,1.53,1.31,1.65,1.85,2015-07-04 07:00:00,0.0,0.0,0.0,0.0,1.0,2.0,1.0,0.0,0.0,2.0,4.0,0.0,0.0,1.0,7.0,1.0,0.0,0.0,0.0
185,05/07/2015 07:00,76.4,3.97,1.64,2.94,4.02,1.59,2.97,4.03,3.57,2.55,6.63,7.48,1.36,0.9275,0.0,1.59,1.3,2.0,1.98,2015-07-05 07:00:00,0.0,0.0,0.0,0.0,0.0,0.0,0.0,0.0,0.0,0.0,0.0,0.0,0.0,0.0,0.0,0.0,0.0,0.0,0.0
186,06/07/2015 07:00,76.44,3.69,1.57,3.12,4.08,1.6,3.2,4.33,3.84,2.69,6.61,7.37,1.39,0.95,0.0,1.5,1.3,1.2,1.42,2015-07-06 07:00:00,0.0,0.0,0.0,0.0,0.0,0.0,0.0,0.0,0.0,0.0,0.0,0.0,0.0,0.0,0.0,0.0,0.0,0.0,0.0
187,07/07/2015 07:00,76.43,3.08,1.41,3.21,4.0,1.53,3.35,4.42,3.96,2.87,6.6,7.45,1.37,0.96,0.0,1.53,1.29,1.35,1.37,2015-07-07 07:00:00,0.0,0.0,0.0,0.0,0.0,0.0,0.0,0.0,0.0,0.0,0.0,0.0,0.0,0.0,0.0,0.0,0.0,0.0,0.0
188,08/07/2015 07:00,76.4,2.19,1.22,3.2,3.67,1.47,3.43,4.3,3.91,3.01,6.58,7.34,1.33,0.99,0.0,1.56,1.27,1.37,1.45,2015-07-08 07:00:00,0.0,0.0,0.0,0.0,0.0,0.0,0.0,0.0,0.0,0.0,0.0,0.0,0.0,0.0,0.0,0.0,0.0,0.0,0.0
189,09/07/2015 07:00,76.38,1.63,1.09,3.15,3.2,1.4,3.46,4.05,3.74,3.11,6.58,7.32,1.37,0.95,0.0,1.52,1.27,1.3,1.5,2015-07-09 07:00:00,0.0,0.0,0.0,0.0,0.0,0.0,0.0,0.0,0.0,0.0,0.0,0.0,0.0,0.0,0.0,0.0,0.0,0.0,0.0
190,10/07/2015 07:00,76.34,1.41,1.01,3.13,2.73,1.32,3.44,3.63,3.47,3.17,6.54,7.38,1.32,0.96,0.0,1.51,1.26,0.97,1.3,2015-07-10 07:00:00,0.0,0.0,0.0,0.0,0.0,0.0,0.0,0.0,0.0,0.0,0.0,0.0,0.0,0.0,0.0,0.0,0.0,0.0,0.0
191,11/07/2015 07:00,76.31,1.29,0.96,3.09,2.39,1.25,3.42,3.08,3.07,3.18,6.52,7.42,1.32,0.93,0.0,1.48,1.26,1.45,1.3,2015-07-11 07:00:00,0.0,0.0,0.0,0.0,0.0,0.0,0.0,0.0,0.0,0.0,0.0,0.0,0.0,0.0,0.0,0.0,0.0,1.0,5.0
192,12/07/2015 07:00,76.31,1.21,0.92,2.88,2.17,1.18,3.39,2.66,2.71,3.17,6.52,7.45,1.4,0.82,0.0,1.36,1.26,1.43,1.65,2015-07-12 07:00:00,0.0,0.0,0.0,0.0,0.0,0.0,0.0,0.0,0.0,0.0,0.0,0.0,0.0,0.0,0.0,0.0,0.0,0.0,0.0
193,13/07/2015 07:00,76.3,1.2,0.95,2.64,2.11,1.16,3.29,2.52,2.54,3.17,6.54,7.35,1.45,0.73,0.0,1.27,1.28,1.0,1.45,2015-07-13 07:00:00,3.0,5.0,11.0,77.0,16.0,0.0,20.0,18.0,30.0,36.0,12.0,0.0,0.0,5.0,10.0,0.0,15.0,2.0,0.0
194,14/07/2015 07:00,76.25,2.05,0.99,3.03,2.39,1.23,3.3,2.81,2.67,3.865,6.49,7.5,1.46,0.86,0.0,1.42,1.3,1.58,1.6,2015-07-14 07:00:00,0.0,6.0,9.0,12.0,10.0,2.0,13.0,0.0,3.0,11.0,0.0,0.0,0.0,0.0,0.0,0.0,0.0,0.0,0.0
195,15/07/2015 07:00,76.28,2.89,1.03,3.16,3.03,1.75,3.67,3.19,2.96,3.1,6.46,7.45,1.51,0.9749999999999999,0.0,1.59,1.31,1.15,1.4,2015-07-15 07:00:00,0.0,0.0,0.0,0.0,0.0,0.0,0.0,0.0,0.0,0.0,0.0,0.0,0.0,0.0,0.0,0.0,0.0,0.0,0.0
196,16/07/2015 07:00,76.21,3.16,1.04,3.23,3.6325,1.99,3.8,3.42,3.15,3.25,6.4,7.55,1.41,1.06,0.0,1.63,1.3,1.55,1.52,2015-07-16 07:00:00,0.0,0.0,0.0,0.0,0.0,0.0,0.0,0.0,0.0,0.0,0.0,0.0,0.0,0.0,0.0,0.0,0.0,0.0,0.0
197,17/07/2015 07:00,76.18,2.75,1.04,3.39,3.5825,2.05,3.83,3.55,3.26,3.42,6.38,7.53,1.47,1.03,0.0,1.59,1.29,1.45,1.55,2015-07-17 07:00:00,0.0,0.0,0.0,0.0,0.0,0.0,0.0,0.0,0.0,0.0,0.0,0.0,0.0,0.0,0.0,0.0,0.0,0.0,0.0
198,18/07/2015 07:00,76.18,2.09,1.04,3.5,3.83,1.99,3.83,3.69,3.4,3.49,6.34,7.58,1.48,0.95,0.0,1.48,1.29,1.55,1.6,2015-07-18 07:00:00,0.0,0.0,0.0,6.0,0.0,0.0,0.0,0.0,0.0,0.0,0.0,0.0,0.0,0.0,1.0,0.0,0.0,0.0,0.0
199,19/07/2015 07:00,76.15,1.81,1.1,3.58,3.8,1.82,3.85,3.8,3.49,3.53,6.34,7.54,1.45,0.85,0.0,1.36,1.28,1.12,1.5,2015-07-19 07:00:00,0.0,19.0,13.0,5.0,5.0,0.0,3.0,0.0,7.0,19.0,6.0,1.0,0.0,0.0,0.0,0.0,0.0,0.0,0.0
200,20/07/2015 07:00,76.13,3.18,1.95,3.82,3.67,1.66,3.89,3.76,3.51,3.57,6.34,7.55,1.45,0.92,0.0,1.43,1.27,1.52,1.86,2015-07-20 07:00:00,0.0,7.0,12.0,15.0,1.0,2.0,2.0,0.0,2.0,4.0,0.0,0.0,0.0,0.0,0.0,0.0,0.0,0.0,0.0
201,21/07/2015 07:00,76.09,4.05,1.89,4.3,3.84,1.83,4.11,3.77,3.52,3.56,6.3,7.52,1.39,1.02,0.0,1.55,1.25,1.95,2.3,2015-07-21 07:00:00,0.0,0.0,0.0,0.0,0.0,0.0,0.0,0.0,0.0,0.0,0.0,0.0,0.0,0.0,0.0,0.0,0.0,0.0,0.0
202,22/07/2015 07:00,76.06,4.61,1.78,4.49,4.28,2.09,4.41,4.04,3.71,3.61,6.24,7.45,1.36,1.05,0.0,1.56,1.2275,1.98,2.05,2015-07-22 07:00:00,0.0,0.0,0.0,0.0,0.0,0.0,0.0,0.0,0.0,0.0,0.0,0.0,0.0,0.0,0.0,0.0,0.0,0.0,0.0
203,23/07/2015 07:00,76.03,4.82,1.94,4.73,5.18,2.17,4.6,4.22,3.85,3.79,6.23,7.43,1.24,1.05,0.0,1.55,1.24,2.0,1.85,2015-07-23 07:00:00,0.0,0.0,0.0,0.0,0.0,0.0,0.0,0.0,0.0,0.0,0.0,0.0,0.0,0.0,0.0,0.0,0.0,0.0,0.0
204,24/07/2015 07:00,75.99,4.44,2.12,5.66,5.49,2.08,4.76,4.58,4.1,3.95,6.24,7.45,1.23,1.05,0.0,1.53,1.23,1.9,1.91,2015-07-24 07:00:00,0.0,0.0,0.0,0.0,0.0,0.0,0.0,0.0,0.0,0.0,0.0,0.0,0.0,0.0,0.0,0.0,0.0,0.0,0.0
205,25/07/2015 07:00,75.99,3.63,2.09,7.15,5.42,1.98,5.2,4.99,4.4,4.08,6.16,7.38,1.19,1.05,0.0,1.49,1.23,1.95,1.95,2015-07-25 07:00:00,0.0,0.0,0.0,0.0,0.0,0.0,0.0,0.0,0.0,0.0,0.0,0.0,0.0,0.0,0.0,0.0,0.0,0.0,0.0
206,26/07/2015 07:00,76.0,2.69,1.8,7.19,5.19,1.78,5.96,5.34,4.68,4.24,6.2,7.4,1.38,1.04,0.0,1.46,1.23,1.45,1.8,2015-07-26 07:00:00,0.0,0.0,0.0,0.0,0.0,0.0,0.0,0.0,0.0,0.0,0.0,0.0,0.0,0.0,0.0,0.0,0.0,0.0,0.0
207,27/07/2015 07:00,76.09,1.89,1.41,6.95,4.69,1.64,6.63,5.4,4.81,4.56,6.25,7.39,1.44,1.04,0.0,1.39,1.24,1.28,1.68,2015-07-27 07:00:00,0.0,0.0,0.0,0.0,0.0,0.0,0.0,0.0,0.0,0.0,0.0,0.0,0.0,0.0,0.0,0.0,0.0,0.0,0.0
208,28/07/2015 07:00,76.11,1.53,1.19,6.66,3.89,1.52,7.17,5.13,4.68,4.96,6.29,7.6,1.57,1.04,0.0,1.31,1.24,1.25,1.65,2015-07-28 07:00:00,0.0,0.0,0.0,0.0,0.0,0.0,0.0,0.0,0.0,0.0,0.0,0.0,0.0,0.0,0.0,0.0,0.0,0.0,0.0
209,29/07/2015 07:00,76.15,1.36,1.07,6.37,3.19,1.43,7.38,4.51,4.33,5.38,6.34,7.65,1.64,1.04,0.0,1.28,1.25,1.35,1.8,2015-07-29 07:00:00,0.0,0.0,0.0,0.0,0.0,0.0,0.0,0.0,0.0,0.0,0.0,0.0,0.0,0.0,0.0,0.0,0.0,0.0,0.0
210,30/07/2015 07:00,76.19,1.26,1.01,6.04,2.7,1.36,7.33,3.51,3.86,5.74,6.34,7.65,1.68,1.04,0.0,1.3,1.25,1.52,2.02,2015-07-30 07:00:00,0.0,0.0,0.0,0.0,0.0,0.0,0.0,0.0,0.0,0.0,0.0,0.0,0.0,0.0,0.0,0.0,0.0,0.0,0.0
211,31/07/2015 07:00,76.25,1.18,0.97,5.64,2.39,1.31,7.15,2.85,3.22,6.02,6.35,7.55,1.46,1.03,0.0,1.18,1.26,1.68,2.0,2015-07-31 07:00:00,0.0,0.0,0.0,0.0,0.0,0.0,0.0,0.0,0.0,0.0,0.0,0.0,0.0,0.0,8.0,4.0,5.0,0.0,6.0
212,01/08/2015 07:00,76.24,1.11,0.94,4.96,2.2,1.26,6.85,2.56,3.08,6.21,6.45,7.45,1.54,1.03,0.0,1.36,1.29,1.6,1.85,2015-08-01 07:00:00,6.0,0.0,0.0,0.0,0.0,0.0,1.0,14.0,7.0,5.0,1.0,7.0,5.0,7.0,9.0,8.0,11.0,19.0,22.0
213,02/08/2015 07:00,76.3,1.05,0.93,3.93,2.09,1.22,6.43,2.39,3.05,6.32,6.48,7.55,1.61,1.04,0.0,1.26,1.36,1.6,2.05,2015-08-02 07:00:00,0.0,0.0,0.0,4.0,0.0,1.0,1.0,5.0,0.0,0.0,0.0,0.0,0.0,4.0,17.0,5.0,3.0,18.0,0.0
214,03/08/2015 07:00,76.3,1.02,0.91,2.83,2.02,1.2,5.74,2.31,3.11,6.37,6.52,7.55,1.66,1.04,0.0,1.34,1.6,1.5,1.95,2015-08-03 07:00:00,0.0,2.0,1.0,2.0,4.0,7.0,32.0,5.5,87.0,63.0,8.0,0.0,5.0,2.0,1.0,4.0,2.0,0.0,0.0
215,04/08/2015 07:00,76.31,1.0,0.91,2.38,2.08,1.39,4.86,2.67,3.32,6.27,6.5,7.52,1.6,1.04,0.0,1.45,1.66,1.5,1.95,2015-08-04 07:00:00,0.0,0.0,0.0,8.0,19.0,20.0,25.0,0.0,23.0,19.0,0.0,0.0,0.0,0.0,0.0,0.0,0.0,0.0,0.0
216,05/08/2015 07:00,76.36,2.71,1.22,2.51,2.44,1.43,3.89,2.57,3.26,5.94,6.53,7.49,1.6,1.04,0.0,1.43,1.6,1.48,2.0,2015-08-05 07:00:00,4.0,33.0,55.0,9.0,22.0,12.0,2.0,0.0,1.0,0.0,0.0,4.0,0.0,0.0,0.0,0.0,0.0,0.0,0.0
217,06/08/2015 07:00,76.49,3.03,1.63,2.93,3.31,1.85,3.6,2.92,3.19,5.13,6.55,7.53,1.62,1.05,0.0,1.28,1.72,1.48,1.82,2015-08-06 07:00:00,14.0,0.0,0.0,0.0,3.0,0.0,0.0,18.0,0.0,0.0,1.0,7.0,7.0,10.0,15.0,7.0,20.0,45.0,78.0
218,07/08/2015 07:00,76.5,3.86,1.6,3.17,3.86,2.04,3.81,3.68,3.45,4.23,6.65,7.55,1.54,2.62,1.79,2.53,4.7,1.2,1.6,2015-08-07 07:00:00,14.0,0.0,0.0,0.0,0.0,0.0,2.0,22.5,1.0,4.0,26.0,18.0,1.0,153.0,68.0,68.0,66.0,11.0,23.0
219,08/08/2015 07:00,76.55,4.22,1.63,3.41,4.28,2.12,3.94,4.18,3.8,3.78,6.74,7.57,1.59,4.16,3.27,4.27,6.39,1.85,1.95,2015-08-08 07:00:00,5.0,2.0,2.0,2.0,18.0,22.0,13.0,8.0,5.0,5.0,6.0,6.0,1.0,12.0,7.0,7.0,2.0,4.0,2.0
220,09/08/2015 07:00,76.63,4.16,1.83,3.63,4.6,2.05,3.96,4.55,4.08,3.76,6.78,7.63,1.56,3.29,4.22,5.75,5.99,1.5,2.05,2015-08-09 07:00:00,0.0,0.0,0.0,0.0,0.0,0.0,0.0,0.0,0.0,0.0,0.0,0.0,0.0,0.0,0.0,0.0,0.0,0.0,0.0
221,10/08/2015 07:00,76.65,3.94,1.97,3.78,4.67,1.89,4.02,4.79,4.27,3.8,6.83,7.61,1.58,2.45,4.58,6.2,3.72,1.75,1.85,2015-08-10 07:00:00,0.0,0.0,0.0,0.0,0.0,0.0,0.0,0.0,0.0,0.0,0.0,0.0,0.0,0.0,0.0,0.0,0.0,2.0,15.0
222,11/08/2015 07:00,76.69,3.47,1.9,3.88,4.61,1.72,4.08,4.91,4.38,5.03,6.88,7.65,1.43,1.63,4.98,6.09,2.66,1.8,1.95,2015-08-11 07:00:00,0.0,0.0,0.0,0.0,0.0,1.0,1.0,0.75,0.0,0.0,0.0,0.0,0.0,0.0,0.0,0.0,1.0,4.0,11.0
223,12/08/2015 07:00,76.78,2.72,1.76,4.08,4.42,1.73,4.3,4.97,4.43,3.83,6.97,7.4,1.36,1.52,4.89,5.33,2.17,1.9,2.0,2015-08-12 07:00:00,35.0,14.0,16.0,15.0,25.0,32.0,32.0,0.0,34.0,26.0,66.0,39.0,36.0,42.0,25.0,20.0,10.0,2.0,5.0
224,13/08/2015 07:00,77.43,3.09,2.23,4.38,4.93,3.16,5.24,6.01,5.25,5.14,7.49,7.7,9.42,6.74,7.29,7.66,4.65,2.77,2.82,2015-08-13 07:00:00,154.0,43.0,47.0,4.0,67.0,69.0,90.0,22.0,221.0,177.0,108.0,143.0,156.0,150.0,130.0,95.0,67.0,46.0,45.0
225,14/08/2015 07:00,77.65,4.78,2.24,4.96,5.48,2.85,6.38,7.75,6.79,6.51,7.88,8.8,4.28,6.11,9.01,10.03,6.15,3.32,2.6,2015-08-14 07:00:00,5.0,10.0,12.0,5.0,12.0,12.0,13.0,25.0,14.0,15.0,5.0,5.0,5.0,4.0,8.0,1.0,2.0,3.0,18.0
226,15/08/2015 07:00,78.03,5.04,1.97,5.04,5.48,2.73,7.12,8.09,7.35,7.55,8.35,8.25,6.0,4.87,9.52,12.1,7.35,4.55,2.4,2015-08-15 07:00:00,71.0,7.0,9.0,3.0,13.0,14.0,15.0,37.0,39.0,32.0,45.0,65.0,56.0,74.0,85.0,51.0,37.0,4.0,4.0
227,16/08/2015 07:00,78.38,5.53,1.91,4.93,5.68,2.71,7.04,8.06,7.65,7.99,8.61,7.83,3.16,5.26,10.48,11.88,6.27,5.5,2.28,2015-08-16 07:00:00,0.0,0.0,0.0,3.0,0.0,0.0,0.0,0.0,0.0,0.0,1.0,0.0,0.0,0.0,0.0,0.0,0.0,0.0,0.0
228,17/08/2015 07:00,78.74,5.77,2.37,4.7,5.59,2.59,6.86,8.07,7.7,8.05,8.8,7.52,1.96,4.04,11.02,10.83,5.17,5.78,2.45,2015-08-17 07:00:00,0.0,41.0,37.0,0.0,19.0,22.0,17.0,0.0,32.0,22.0,15.0,6.0,9.0,0.0,0.0,0.0,0.0,0.0,0.0
229,18/08/2015 07:00,79.03,6.22,3.17,4.97,5.61,2.76,6.7,8.32,7.82,8.03,9.27,7.86,6.4,3.23,10.7,9.65,3.85,5.45,2.36,2015-08-18 07:00:00,26.0,45.0,47.0,1.0,33.0,18.0,14.0,3.0,32.0,23.0,24.0,29.0,31.0,15.0,10.0,15.0,10.0,9.0,0.0
230,19/08/2015 07:00,79.28,6.39,3.48,5.53,5.72,3.46,6.67,8.62,8.06,7.88,9.48,7.85,2.49,3.78,10.04,8.0,3.04,5.12,2.54,2015-08-19 07:00:00,0.0,6.0,10.0,1.0,7.0,12.0,13.0,0.0,5.0,9.0,0.0,0.0,0.0,0.0,0.0,0.0,0.0,0.0,0.0
231,20/08/2015 07:00,79.53,6.91,3.34,5.84,5.97,3.44,6.79,8.86,8.24,7.6,9.75,7.8,1.84,3.41,9.08,6.49,2.56,5.0,2.75,2015-08-20 07:00:00,0.0,0.0,0.0,0.0,0.0,0.0,0.0,0.0,0.0,0.0,0.0,0.0,0.0,0.0,0.0,0.0,0.0,0.0,0.0
232,21/08/2015 07:00,79.78,6.88,3.12,6.18,5.89,2.93,6.96,9.1,8.37,7.4,9.95,7.73,1.69,2.55,7.42,5.92,2.27,4.95,2.7,2015-08-21 07:00:00,0.0,0.0,0.0,0.0,0.0,0.0,0.0,0.0,0.0,0.0,0.0,0.0,0.0,0.0,0.0,0.0,0.0,0.0,0.0
233,22/08/2015 07:00,80.0,6.52,3.18,6.56,5.78,2.61,7.07,9.28,8.53,7.21,10.19,7.71,1.67,1.97,5.28,5.56,2.11,4.83,2.5,2015-08-22 07:00:00,0.0,0.0,0.0,0.0,0.0,0.0,0.0,0.0,0.0,0.0,0.0,0.0,0.0,0.0,0.0,0.0,0.0,0.0,0.0
234,23/08/2015 07:00,80.15,6.12,3.33,7.0,5.66,2.35,7.1,9.28,8.56,7.03,10.46,7.75,1.69,1.64,4.32,5.07,1.97,4.73,2.45,2015-08-23 07:00:00,0.0,0.0,0.0,0.0,0.0,0.0,0.0,0.0,0.0,0.0,0.0,0.0,0.0,0.0,0.0,0.0,0.0,0.0,0.0
235,24/08/2015 07:00,80.38,5.72,3.27,7.14,5.49,2.11,7.16,9.13,8.47,6.85,10.52,7.74,1.68,1.49,3.71,4.55,1.85,3.8,2.77,2015-08-24 07:00:00,0.0,0.0,0.0,0.0,0.0,0.0,0.0,0.0,0.0,0.0,0.0,0.0,0.0,0.0,0.0,0.0,0.0,0.0,0.0
236,25/08/2015 07:00,80.59,5.16,2.97,7.04,5.29,1.9,7.31,8.85,8.125,6.72,10.72,7.78,1.56,1.4,3.07,4.03,1.77,3.0,2.27,2015-08-25 07:00:00,0.0,0.0,0.0,0.0,0.0,0.0,0.0,0.0,0.0,0.0,0.0,0.0,0.0,0.0,0.0,0.0,0.0,0.0,0.0
237,26/08/2015 07:00,80.75,4.18,2.62,6.84,4.97,1.72,7.53,8.52,7.99,6.64,10.9,7.63,1.6,1.34,2.07,3.59,1.72,1.98,1.75,2015-08-26 07:00:00,0.0,0.0,0.0,0.0,0.0,0.0,0.0,5.0,0.0,0.0,0.0,0.0,0.0,0.0,0.0,0.0,2.0,2.0,5.0
238,27/08/2015 07:00,80.88,2.94,2.32,6.69,4.44,1.91,7.62,8.31,7.79,6.8,11.15,7.78,3.74,2.04,3.07,4.04,1.83,1.3,1.7,2015-08-27 07:00:00,26.0,1.0,1.0,35.0,12.0,16.0,26.0,19.5,67.0,60.0,42.0,22.0,22.0,25.0,25.0,25.0,14.0,12.0,26.0
239,28/08/2015 07:00,81.0,2.06,2.0,6.36,3.91,2.1,7.57,8.0,7.56,6.92,11.2,8.07,1.88,4.04,3.21,4.69,2.47,1.87,1.6,2015-08-28 07:00:00,0.0,0.0,0.0,0.0,0.0,0.0,0.0,0.0,0.0,0.0,0.0,0.0,0.0,0.0,0.0,0.0,0.0,0.0,0.0
240,29/08/2015 07:00,81.09,1.67,1.62,6.09,3.65,1.98,7.43,7.62,7.27,7.19,11.29,8.0,1.8,3.1,3.47,4.76,3.46,1.95,1.6,2015-08-29 07:00:00,0.0,0.0,0.0,0.0,0.0,0.0,0.0,0.0,0.0,0.0,0.0,0.0,0.0,0.0,0.0,0.0,0.0,0.0,0.0
241,30/08/2015 07:00,81.18,1.53,1.32,5.77,3.41,1.85,7.24,7.14,6.99,7.37,11.31,8.1,1.79,2.05,3.56,5.32,2.97,2.1,1.35,2015-08-30 07:00:00,0.0,0.0,0.0,0.0,0.0,0.0,0.0,0.0,0.0,0.0,0.0,0.0,0.0,0.0,0.0,0.0,0.0,0.0,0.0
242,31/08/2015 07:00,81.21,1.42,1.23,5.32,3.07,1.77,6.97,6.49,6.66,7.37,11.43,8.14,1.81,1.52,3.73,5.34,2.32,1.98,1.6,2015-08-31 07:00:00,0.0,0.0,0.0,0.0,0.0,0.0,0.0,0.0,0.0,0.0,0.0,0.0,0.0,0.0,0.0,0.0,0.0,0.0,0.0
243,01/09/2015 07:00,81.24,1.28,1.19,4.64,2.78,1.66,6.63,5.36,6.14,7.21,11.45,8.15,1.79,1.34,3.84,4.8,1.95,2.08,2.25,2015-09-01 07:00:00,0.0,0.0,0.0,16.0,5.0,5.0,6.0,0.0,5.0,10.0,0.0,0.0,0.0,0.0,0.0,0.0,0.0,0.0,0.0
244,02/09/2015 07:00,81.25,1.16,1.13,3.97,2.54,1.55,6.14,4.16,5.55,6.95,11.46,8.13,1.8,1.28,3.29,4.04,1.78,2.65,2.27,2015-09-02 07:00:00,0.0,0.0,0.0,0.0,0.0,0.0,0.0,0.0,0.0,0.0,0.0,0.0,0.0,0.0,0.0,0.0,0.0,0.0,0.0
245,03/09/2015 07:00,81.21,1.07,1.07,3.51,2.35,1.46,5.48,3.62,5.29,6.63,11.44,8.2,1.91,1.23,2.09,3.53,1.68,2.35,1.9,2015-09-03 07:00:00,0.0,0.0,0.0,0.0,0.0,0.0,0.0,0.0,0.0,0.0,0.0,0.0,0.0,0.0,0.0,0.0,0.0,0.0,0.0
246,04/09/2015 07:00,81.21,1.0,1.02,3.17,2.2,1.39,4.75,3.31,5.14,6.18,11.41,8.25,1.92,1.18,1.48,3.29,1.61,2.1,1.88,2015-09-04 07:00:00,0.0,0.0,0.0,0.0,0.0,0.0,0.0,0.0,0.0,0.0,0.0,0.0,0.0,0.0,0.0,0.0,0.0,0.0,0.0
247,05/09/2015 07:00,81.18,0.95,0.97,2.73,2.09,1.32,4.09,3.06,4.99,5.52,11.38,8.16,1.82,1.15,1.18,3.14,1.58,2.08,1.6,2015-09-05 07:00:00,0.0,0.0,0.0,0.0,0.0,0.0,0.0,0.0,0.0,0.0,0.0,0.0,0.0,0.0,0.0,0.0,0.0,0.0,0.0
248,06/09/2015 07:00,81.15,0.91,0.94,2.23,2.01,1.27,3.53,2.86,4.84,4.78,11.35,8.15,1.84,1.12,1.04,2.95,1.55,1.76,1.5,2015-09-06 07:00:00,0.0,0.0,0.0,0.0,0.0,0.0,0.0,0.0,0.0,0.0,0.0,0.0,0.0,0.0,0.0,0.0,0.0,0.0,0.0
249,07/09/2015 07:00,81.09,0.88,0.91,1.9,1.96,1.22,3.01,2.7,4.71,4.05,11.3,8.28,1.87,1.09,0.92,2.74,1.53,1.63,1.25,2015-09-07 07:00:00,0.0,0.0,0.0,0.0,0.0,0.0,0.0,0.0,0.0,0.0,0.0,0.0,0.0,0.0,0.0,0.0,0.0,0.0,0.0
250,08/09/2015 07:00,81.03,0.85,0.89,1.71,1.9,1.18,2.63,2.6,4.66,3.45,11.26,8.09,1.83,1.06,0.82,2.57,1.51,1.83,1.4,2015-09-08 07:00:00,0.0,0.0,0.0,0.0,0.0,0.0,0.0,0.0,0.0,0.0,0.0,0.0,0.0,0.0,0.0,0.0,0.0,0.0,0.0
251,09/09/2015 07:00,81.03,0.83,0.89,1.58,1.85,1.14,2.41,2.5,4.57,3.01,11.21,8.16,1.93,1.03,0.75,2.57,1.49,1.85,1.4,2015-09-09 07:00:00,0.0,0.0,0.0,0.0,0.0,0.0,0.0,0.0,0.0,0.0,0.0,0.0,0.0,0.0,0.0,0.0,0.0,0.0,0.0
252,10/09/2015 07:00,80.94,0.81,0.86,1.48,1.82,1.11,2.25,2.45,4.57,2.73,11.15,8.1,1.93,1.01,0.73,2.55,1.53,1.5,1.89,2015-09-10 07:00:00,17.0,0.0,0.0,6.0,7.0,7.0,8.0,22.0,9.0,8.0,21.0,21.0,16.0,21.0,15.0,17.0,22.0,22.0,22.0
253,11/09/2015 07:00,80.88,0.81,0.87,1.41,1.81,1.1,2.18,2.43,4.5,2.62,11.11,8.05,1.84,1.02,0.73,2.63,1.62,1.89,2.0,2015-09-11 07:00:00,0.0,4.0,3.0,7.0,6.0,6.0,9.0,0.0,18.0,17.0,2.0,0.0,0.0,0.0,0.0,0.0,0.0,1.0,0.0
254,12/09/2015 07:00,80.84,0.8,0.86,1.35,1.78,1.08,2.09,2.36,4.44,2.54,11.01,8.14,1.99,1.06,0.75,2.68,1.86,2.0,1.89,2015-09-12 07:00:00,0.0,0.0,0.0,0.0,0.0,0.0,0.0,0.0,0.0,0.0,0.0,0.0,0.0,0.0,0.0,0.0,0.0,0.0,0.0
255,13/09/2015 07:00,80.81,0.82,0.85,1.3,1.78,1.06,2.02,2.28,4.35,2.53,10.95,8.28,1.93,1.07,0.78,2.64,1.97,1.85,1.55,2015-09-13 07:00:00,0.0,0.0,0.0,0.0,0.0,0.0,0.0,0.0,0.0,0.0,0.0,0.0,0.0,0.0,0.0,0.0,0.0,0.0,0.0
256,14/09/2015 07:00,80.78,0.84,0.85,1.26,1.76,1.03,1.96,2.26,4.32,2.41,10.96,8.1,1.79,1.01,0.75,2.6,1.84,1.47,1.32,2015-09-14 07:00:00,0.0,0.0,0.0,0.0,0.0,0.0,0.0,0.0,0.0,0.0,0.0,0.0,0.0,0.0,0.0,0.0,0.0,0.0,0.0
257,15/09/2015 07:00,80.78,0.8,0.87,1.22,1.72,1.0,1.91,2.23,4.25,2.29,10.91,8.0,1.79,0.97,0.73,2.52,1.72,1.5,1.2,2015-09-15 07:00:00,0.0,0.0,0.0,0.0,0.0,0.0,0.0,0.0,0.0,0.0,0.0,0.0,0.0,0.0,0.0,0.0,0.0,0.0,0.0
258,16/09/2015 07:00,80.71,0.86,1.15,1.2,1.72,0.97,1.86,2.21,4.26,2.21,10.89,8.05,1.84,0.93,0.71,2.47,1.62,1.45,1.4,2015-09-16 07:00:00,1.0,26.0,41.0,12.0,16.0,5.0,3.0,0.0,3.0,2.0,12.0,0.0,0.0,0.0,0.0,0.0,0.0,0.0,0.0
259,17/09/2015 07:00,80.68,2.07,1.63,1.45,1.74,1.03,1.93,2.2,4.21,2.16,10.86,7.98,1.82,0.91,0.71,2.46,1.56,1.75,1.8,2015-09-17 07:00:00,0.0,21.0,22.0,11.0,5.0,3.0,5.0,0.0,5.0,6.0,0.0,0.0,0.0,1.0,0.0,0.0,0.0,0.0,0.0
260,18/09/2015 07:00,80.63,2.92,1.62,1.39,2.1,1.11,2.11,2.25,4.17,2.14,10.8,8.05,1.8,0.89,0.61,2.4,1.51,1.75,1.55,2015-09-18 07:00:00,0.0,0.0,0.0,0.0,0.0,0.0,0.0,0.0,0.0,0.0,0.0,0.0,0.0,0.0,0.0,0.0,0.0,0.0,0.0
261,19/09/2015 07:00,80.61,3.08,1.54,1.43,2.66,1.16,2.04,2.7,4.16,2.2,10.78,8.0,1.83,0.88,0.54,2.3,1.48,1.68,1.75,2015-09-19 07:00:00,0.0,0.0,0.0,0.0,0.0,0.0,0.0,0.0,0.0,0.0,0.0,0.0,0.0,0.0,0.0,0.0,0.0,0.0,0.0
262,20/09/2015 07:00,80.61,2.92,1.67,2.03,3.35,1.19,2.1,3.15,4.25,2.22,10.78,7.8,1.83,0.86,0.47,2.18,1.46,0.98,1.4,2015-09-20 07:00:00,0.0,0.0,0.0,0.0,0.0,0.0,0.0,0.0,0.0,0.0,0.0,0.0,0.0,0.0,0.0,0.0,0.0,0.0,0.0
263,21/09/2015 07:00,80.68,2.61,1.89,2.59,3.67,1.22,2.53,3.54,4.26,2.18,10.74,7.85,1.82,0.85,0.4,2.03,1.45,1.5,2.0,2015-09-21 07:00:00,0.0,12.0,11.0,0.0,1.0,0.0,0.0,0.0,0.0,0.0,1.0,0.0,0.0,0.0,0.0,0.0,0.0,0.0,0.0
264,22/09/2015 07:00,80.65,2.67,2.1,3.18,3.84,1.46,3.07,3.87,4.42,2.33,10.82,7.83,1.76,0.84,0.36,1.97,1.44,1.8,2.2,2015-09-22 07:00:00,1.0,18.0,17.0,38.0,10.0,12.0,12.0,0.0,13.0,10.0,0.0,1.0,3.0,7.0,1.0,0.0,0.0,0.0,0.0
265,23/09/2015 07:00,80.69,3.83,3.36,3.69,3.95,1.79,3.91,4.05,4.48,2.67,10.83,7.75,1.77,0.83,0.36,1.93,1.43,2.04,2.53,2015-09-23 07:00:00,24.0,38.0,56.0,12.0,16.0,25.0,38.0,5.0,48.0,25.0,33.0,29.0,25.0,8.0,18.0,16.0,4.0,5.0,0.0
266,24/09/2015 07:00,80.75,5.33,2.95,4.86,5.28,3.26,5.27,5.29,5.13,4.22,10.98,7.86,4.75,1.17,0.59,2.03,1.44,2.0,2.25,2015-09-24 07:00:00,25.0,14.0,14.0,29.0,64.0,48.0,30.0,2.0,78.0,76.0,56.0,34.0,44.0,15.0,6.0,8.0,1.0,1.0,0.0
267,25/09/2015 07:00,80.86,5.42,3.24,5.05,5.64,4.29,6.43,6.6,6.425000000000001,5.925,11.1,8.05,3.6,4.37,1.53,3.29,1.76,2.1,2.43,2015-09-25 07:00:00,31.0,16.0,15.0,17.0,5.0,0.0,22.0,27.0,2.0,4.0,21.0,48.0,16.0,36.0,29.0,20.0,22.0,25.0,35.0
268,26/09/2015 07:00,80.96,5.53,3.46,5.78,6.11,3.27,7.16,6.52,6.0,5.26,11.16,8.02,2.27,4.49,3.08,4.27,2.06,2.21,2.1,2015-09-26 07:00:00,0.0,0.0,1.0,5.0,0.0,0.0,0.0,0.0,0.0,0.0,1.0,1.0,3.0,8.0,6.0,6.0,3.0,0.0,0.0
269,27/09/2015 07:00,81.03,5.72,3.46,6.325,5.95,2.81,7.44,7.8100000000000005,7.445,6.27,11.28,7.85,1.78,3.9,3.81,5.83,2.29,2.05,1.75,2015-09-27 07:00:00,0.0,0.0,0.0,0.0,0.0,0.0,0.0,0.0,0.0,0.0,0.0,0.0,0.0,0.0,0.0,0.0,0.0,0.0,0.0
270,28/09/2015 07:00,81.15,5.73,3.38,7.685,5.8,2.51,8.25,8.825,8.297500000000001,8.01,11.36,7.7,1.56,2.94,4.49,6.71,2.14,2.0,1.59,2015-09-28 07:00:00,0.0,0.0,0.0,0.0,0.0,0.0,0.0,0.0,0.0,0.0,0.0,0.0,0.0,0.0,0.0,0.0,0.0,0.0,0.0
271,29/09/2015 07:00,81.24,5.47,3.17,7.85,5.65,2.25,8.71,7.93,7.86,8.39,11.45,7.75,1.52,2.29,5.11,6.34,1.95,2.0,1.15,2015-09-29 07:00:00,2.0,0.0,0.0,0.0,0.0,0.0,0.0,10.0,4.0,0.25,0.0,1.0,1.0,4.0,10.0,1.0,5.0,10.0,12.0
272,30/09/2015 07:00,81.31,4.85,2.77,7.54,5.47,2.02,8.87,7.74,7.74,8.39,11.52,7.7,1.54,1.81,5.08,5.64,1.79,1.98,1.8,2015-09-30 07:00:00,0.0,2.0,2.0,2.0,2.0,2.0,3.0,0.0,0.0,0.75,0.0,0.0,0.0,0.0,0.0,0.0,0.0,0.0,0.0
273,01/10/2015 07:00,81.4,3.67,2.19,7.23,5.23,1.81,8.62,7.55,7.6,8.27,11.56,7.94,1.8,1.53,4.36,4.83,1.7,2.05,2.0,2015-10-01 07:00:00,0.0,0.0,0.0,0.0,0.0,0.0,1.0,0.0,0.0,2.0,0.0,0.0,0.0,0.0,0.0,0.0,0.0,0.0,0.0
274,02/10/2015 07:00,81.49,2.5,1.76,6.95,4.83,1.66,8.34,7.34,7.48,8.56,11.75,8.6,2.92,1.75,3.53,4.5,1.97,2.4,2.2,2015-10-02 07:00:00,18.0,12.0,11.0,4.0,13.0,0.0,8.0,45.0,11.0,11.0,72.0,31.0,20.0,50.0,55.0,5.0,37.0,64.0,80.0
275,03/10/2015 07:00,81.46,2.08,1.49,6.66,4.22,1.6,8.11,7.05,7.46,8.54,11.77,8.71,2.27,4.28,4.51,6.37,6.04,2.93,2.66,2015-10-03 07:00:00,0.0,1.0,0.0,8.0,0.0,0.0,2.0,0.0,0.0,1.0,1.0,0.0,1.0,0.0,0.0,0.0,0.0,1.0,0.0
276,04/10/2015 07:00,81.5,2.01,1.28,6.36,3.77,1.62,7.9,6.68,7.37,8.4,11.7,8.55,1.93,4.11,5.64,6.76,7.12,3.08,2.45,2015-10-04 07:00:00,0.0,0.0,0.0,0.0,0.0,0.0,0.0,0.0,0.0,0.0,0.0,0.0,0.0,0.0,0.0,0.0,0.0,0.0,0.0
277,05/10/2015 07:00,81.59,1.84,1.17,6.06,3.48,1.58,7.69,6.11,7.21,8.2,11.8,8.58,2.04,2.85,5.78,7.42,4.92,3.3,2.0,2015-10-05 07:00:00,0.0,0.0,0.0,0.0,0.0,0.0,0.0,0.0,0.0,0.0,0.0,0.0,0.0,0.0,0.0,0.0,0.0,0.0,0.0
278,06/10/2015 07:00,81.63,1.65,1.15,5.7,3.18,1.52,7.44,5.16,6.85,7.96,11.83,8.63,1.98,2.01,5.91,7.01,3.12,3.7,2.0,2015-10-06 07:00:00,0.0,0.0,0.0,0.0,0.0,0.0,0.0,0.0,0.0,0.0,0.0,0.0,0.0,0.0,0.0,0.0,0.0,0.0,0.0
279,07/10/2015 07:00,81.59,2.0,1.28,5.13,2.97,1.66,7.18,4.16,6.3,7.75,11.85,8.62,1.99,1.63,5.85,5.78,2.34,4.13,2.05,2015-10-07 07:00:00,0.0,20.0,27.0,11.0,16.0,0.0,21.0,0.0,26.0,19.0,23.0,0.0,0.0,0.0,0.0,0.0,0.0,0.0,0.0
280,08/10/2015 07:00,81.61,3.2,2.17,4.54,3.24,2.07,6.87,5.0,6.24,7.55,11.8,8.78,2.55,1.5,4.82,4.74,1.99,3.8,2.18,2015-10-08 07:00:00,3.0,27.0,50.0,19.0,25.0,0.0,12.0,0.0,47.0,24.0,10.0,5.0,4.0,3.0,9.0,11.0,0.0,0.0,0.0
281,09/10/2015 07:00,81.59,4.79,2.84,4.6,4.09,2.59,6.63,5.5,6.3,7.4,11.78,8.8,2.36,1.48,3.53,4.18,1.82,3.62,2.4,2015-10-09 07:00:00,0.0,14.0,14.0,27.0,5.0,0.0,4.0,0.0,5.0,4.0,13.0,0.0,0.0,1.0,0.0,0.0,0.0,0.0,0.0
282,10/10/2015 07:00,81.56,5.61,2.68,4.58,4.82,2.76,6.49,5.8,6.34,6.9975000000000005,11.78,8.78,2.09,1.64,2.92,4.01,1.72,3.66,2.4,2015-10-10 07:00:00,0.0,1.0,4.0,4.0,4.0,0.0,4.0,0.0,1.0,1.0,0.0,0.0,0.0,0.0,0.0,0.0,0.0,0.0,0.0
283,11/10/2015 07:00,81.53,6.53,2.6,4.72,5.74,2.85,6.42,5.9,6.38,7.12,11.75,8.72,2.02,1.69,2.16,4.2,1.66,3.7,2.45,2015-10-11 07:00:00,1.0,10.0,12.0,12.0,7.0,0.0,8.0,0.0,1.0,2.0,5.0,3.0,1.0,2.0,5.0,4.0,1.0,0.0,0.0
284,12/10/2015 07:00,81.5,6.49,2.9,5.07,5.78,2.63,6.39,5.98,6.48,6.89,11.66,8.78,2.06,1.49,1.97,3.84,1.62,3.22,2.3,2015-10-12 07:00:00,3.0,5.0,5.0,10.0,5.0,0.0,6.0,0.0,7.0,8.0,0.0,6.0,4.0,0.0,9.0,0.0,0.0,0.0,0.0
285,13/10/2015 07:00,81.49,6.21,3.14,5.62,5.68,2.45,6.41,6.63,6.69,6.58,11.69,8.85,2.07,1.45,1.67,3.73,1.57,3.09,2.0,2015-10-13 07:00:00,1.0,0.0,0.0,0.0,0.0,0.0,2.0,0.0,0.0,1.0,0.0,0.0,0.0,1.0,0.0,0.0,0.0,0.0,0.0
286,14/10/2015 07:00,81.49,5.91,3.29,6.71,5.56,2.31,6.52,6.92,6.91,6.29,11.66,8.85,2.1,1.49,1.5,3.43,1.57,2.95,1.95,2015-10-14 07:00:00,0.0,0.0,0.0,0.0,0.0,0.0,0.0,0.0,0.0,0.0,0.0,0.0,0.0,0.0,0.0,0.0,0.0,0.0,0.0
287,15/10/2015 07:00,81.46,5.98,4.33,7.23,5.51,2.49,6.71,6.96,6.97,6.16,11.66,8.7,1.98,1.5,1.34,3.1,1.56,3.0,2.0,2015-10-15 07:00:00,1.0,47.0,62.0,32.0,47.0,41.0,11.0,20.0,26.0,20.0,19.0,1.0,2.0,0.0,3.0,2.0,6.0,4.0,5.0
288,16/10/2015 07:00,81.38,5.88,4.16,7.37,5.56,2.76,7.47,7.23,7.1,6.26,11.66,8.6,2.01,1.46,1.13,3.16,1.52,3.05,2.1,2015-10-16 07:00:00,0.0,0.0,0.0,8.0,0.0,2.0,3.0,0.0,0.0,0.0,0.0,0.0,0.0,0.0,0.0,0.0,0.0,0.0,0.0
289,17/10/2015 07:00,81.38,5.89,4.38,7.7,5.9,3.38,8.08,7.33,7.23,6.39,11.62,8.85,2.12,1.42,1.01,3.23,1.5,3.15,2.5,2015-10-17 07:00:00,0.0,0.0,0.0,0.0,0.0,0.0,0.0,0.0,0.0,0.0,0.0,0.0,0.0,0.0,0.0,0.0,0.0,0.0,0.0
290,18/10/2015 07:00,81.36,6.27,4.08,7.79,5.85,2.8,8.38,7.38,7.26,6.65,11.59,8.78,2.0,1.4,0.97,3.17,1.49,3.0,2.5,2015-10-18 07:00:00,0.0,0.0,0.0,0.0,0.0,0.0,0.0,0.0,0.0,0.0,0.0,0.0,0.0,0.0,0.0,0.0,0.0,0.0,0.0
291,19/10/2015 07:00,81.38,6.17,4.11,8.02,5.72,2.45,8.61,7.78,7.51,7.0,11.56,8.57,1.87,1.37,0.9,2.9,1.51,2.95,2.35,2015-10-19 07:00:00,0.0,1.0,1.0,0.0,0.0,0.0,0.0,0.0,0.0,0.0,0.0,0.0,0.0,0.0,0.0,0.0,0.0,0.0,0.0
292,20/10/2015 07:00,81.38,6.46,5.25,7.9,5.67,2.66,8.86,7.9,7.75,7.62,11.6,8.65,2.17,1.39,1.67,2.94,1.65,2.9,2.4,2015-10-20 07:00:00,50.0,81.0,102.0,26.0,47.0,50.0,41.0,25.0,58.0,51.0,48.0,58.0,7.0,44.0,43.0,45.0,47.0,19.0,20.0
293,21/10/2015 07:00,81.4,6.85,5.59,7.67,5.62,3.01,8.98,8.01,7.89,8.14,11.66,8.88,3.46,1.66,2.94,3.7,1.7,2.9,2.5,2015-10-21 07:00:00,0.0,3.0,5.0,8.0,1.0,3.0,5.0,0.0,5.0,2.0,0.0,0.0,1.0,0.0,0.0,0.0,0.0,0.0,0.0
294,22/10/2015 07:00,81.43,7.98,5.42,7.46,5.95,3.18,8.86,8.03,8.02,8.56,11.66,8.79,2.08,2.98,3.02,4.1,2.24,3.3,2.59,2015-10-22 07:00:00,0.0,0.0,0.0,0.0,0.0,0.0,0.0,0.0,0.0,0.0,0.0,0.0,0.0,0.0,0.0,0.0,0.0,0.0,0.0
295,23/10/2015 07:00,81.44,7.47,5.17,7.35,5.91,2.78,8.66,8.11,8.17,8.76,11.7,8.75,2.05,2.27,2.98,4.42,2.32,3.58,2.66,2015-10-23 07:00:00,0.0,0.0,0.0,0.0,0.0,0.0,0.0,0.0,0.0,0.0,0.0,0.0,0.0,0.0,0.0,0.0,0.0,0.0,0.0
296,24/10/2015 07:00,81.53,6.74,5.21,7.71,5.85,2.44,8.43,8.4,8.46,8.77,11.73,8.76,2.01,1.56,2.98,4.44,2.1,3.7,2.8,2015-10-24 07:00:00,0.0,0.0,0.0,0.0,0.0,0.0,0.0,0.0,0.0,0.0,0.0,0.0,0.0,0.0,0.0,0.0,0.0,0.0,0.0
297,25/10/2015 07:00,81.63,6.21,5.05,7.75,5.69,2.19,8.42,8.67,8.71,8.67,11.75,8.75,2.0,1.46,2.83,4.18,1.92,3.58,2.75,2015-10-25 07:00:00,0.0,0.0,0.0,0.0,0.0,0.0,0.0,0.0,0.0,0.0,0.0,0.0,0.0,0.0,0.0,0.0,0.0,0.0,0.0
298,26/10/2015 07:00,81.69,5.75,4.6,7.49,5.52,1.94,8.54,8.85,8.85,8.5,11.9,8.7,1.97,1.41,2.11,3.64,1.74,3.5,2.75,2015-10-26 07:00:00,0.0,3.0,3.0,0.0,0.0,0.0,0.0,0.0,0.0,0.0,0.0,0.0,0.0,0.0,0.0,0.0,0.0,0.0,2.0
299,27/10/2015 07:00,81.75,5.0,3.74,7.49,5.3,1.75,8.5,8.85,8.85,8.5,11.98,8.85,2.11,1.38,1.62,3.13,1.74,3.3,2.52,2015-10-27 07:00:00,0.0,3.0,2.0,0.0,0.0,0.0,0.0,10.0,0.0,0.0,0.0,0.0,0.0,9.0,10.0,17.0,18.0,4.0,4.0
300,28/10/2015 07:00,81.84,3.84,2.74,6.92,4.92,1.61,8.24,8.55,8.71,8.29,12.04,8.85,2.07,1.37,1.22,2.89,1.68,3.03,2.41,2015-10-28 07:00:00,0.0,0.0,0.0,0.0,0.0,0.0,0.0,0.0,0.0,0.0,0.0,0.0,0.0,0.0,0.0,0.0,0.0,0.0,0.0
301,29/10/2015 07:00,81.9,2.73,1.9,6.64,4.21,1.5,8.05,8.17,8.45,8.26,12.1,9.0,2.08,1.37,1.01,2.68,1.74,2.9,2.35,2015-10-29 07:00:00,0.0,0.0,0.0,0.0,0.0,0.0,0.0,0.0,0.0,0.0,0.0,0.0,0.0,0.0,0.0,0.0,0.0,0.0,0.0
302,30/10/2015 07:00,81.9,2.08,1.5,6.37,3.56,1.45,7.84,7.76,8.13,8.17,12.14,9.24,2.25,1.38,0.82,2.55,1.84,2.95,2.3,2015-10-30 07:00:00,0.0,10.0,10.0,10.0,23.0,31.0,26.0,5.0,3.0,5.0,5.0,0.0,0.0,0.0,0.0,2.0,5.0,19.0,13.0
303,31/10/2015 07:00,81.9,2.98,2.04,6.22,3.28,1.73,7.66,7.33,7.8,8.01,12.15,9.15,2.04,1.37,0.73,2.59,1.8,3.22,2.75,2015-10-31 07:00:00,0.0,15.0,19.0,9.0,10.0,11.0,15.0,0.0,12.0,12.0,3.0,1.0,0.0,1.0,0.0,0.0,0.0,0.0,0.0
304,01/11/2015 07:00,81.9,3.84,2.08,6.01,3.82,2.01,7.49,6.83,7.44,7.81,12.1,9.17,2.14,1.34,0.68,2.58,1.78,3.39,2.61,2015-11-01 07:00:00,0.0,0.0,0.0,0.0,0.0,0.0,0.0,0.0,0.0,0.0,0.0,0.0,0.0,0.0,0.0,0.0,0.0,0.0,0.0
305,02/11/2015 07:00,81.9,4.36,1.85,5.69,4.3,2.34,7.31,6.44,7.01,7.58,12.01,9.0,2.14,1.32,0.59,2.53,1.68,3.5,2.5,2015-11-02 07:00:00,0.0,0.0,0.0,0.0,0.0,0.0,0.0,0.0,0.0,0.0,0.0,0.0,0.0,0.0,0.0,0.0,0.0,0.0,0.0
306,03/11/2015 07:00,81.81,4.46,1.92,5.35,5.02,2.4,7.08,5.92,6.49,7.32,11.99,9.1,2.06,1.3,0.59,2.41,1.62,3.3,2.4,2015-11-03 07:00:00,0.0,0.0,0.0,0.0,0.0,0.0,0.0,0.0,0.0,0.0,0.0,0.0,0.0,0.0,0.0,0.0,0.0,0.0,0.0
307,04/11/2015 07:00,81.78,4.21,2.1,5.08,5.24,2.2,6.78,5.62,6.19,7.04,11.98,9.0,2.2,1.29,0.5,2.4,1.54,3.5,2.45,2015-11-04 07:00:00,0.0,2.0,2.0,0.0,0.0,0.0,0.0,0.0,0.0,0.0,0.0,0.0,0.0,0.0,5.0,1.0,0.0,0.0,0.0
308,05/11/2015 07:00,81.68,3.79,2.2,4.93,5.16,1.98,6.41,5.48,6.05,6.73,11.9,9.15,2.14,1.28,0.5,2.37,1.51,3.5,2.45,2015-11-05 07:00:00,0.0,8.0,8.0,0.0,0.0,0.0,0.0,0.0,0.0,0.0,0.0,0.0,0.0,0.0,0.0,0.0,0.0,0.0,0.0
309,06/11/2015 07:00,81.56,3.45,2.07,4.86,4.95,1.76,6.03,4.95,5.95,6.39,11.8,9.1,2.08,1.27,0.47,2.33,1.45,3.45,2.15,2015-11-06 07:00:00,0.0,0.0,0.0,0.0,0.0,0.0,0.0,0.0,0.0,0.0,0.0,0.0,0.0,0.0,0.0,0.0,0.0,0.0,0.0
310,07/11/2015 07:00,81.48,3.65,1.9,4.91,4.44,1.6,5.74,4.84,5.82,6.01,11.7,9.05,2.07,1.26,0.4,2.22,1.4,3.35,2.01,2015-11-07 07:00:00,0.0,0.0,0.0,0.0,0.0,0.0,0.0,0.0,0.0,0.0,0.0,0.0,0.0,0.0,0.0,0.0,0.0,0.0,0.0
311,08/11/2015 07:00,81.44,3.79,1.78,4.99,3.78,1.49,5.57,4.61,5.63,5.56,11.62,8.8,2.08,1.26,0.36,2.1,1.39,3.3,1.9,2015-11-08 07:00:00,0.0,0.0,0.0,0.0,0.0,0.0,0.0,0.0,0.0,0.0,0.0,0.0,0.0,0.0,0.0,0.0,0.0,0.0,0.0
312,09/11/2015 07:00,81.34,3.61,1.69,5.03,3.17,1.4,5.51,4.27,5.43,5.2,11.56,8.75,2.01,1.25,0.31,1.99,1.37,2.9,1.77,2015-11-09 07:00:00,0.0,0.0,0.0,0.0,0.0,0.0,0.0,0.0,0.0,0.0,0.0,0.0,0.0,0.0,0.0,0.0,0.0,0.0,0.0
313,10/11/2015 07:00,81.31,3.36,1.75,4.94,2.74,1.34,5.48,3.9,5.27,4.98,11.45,8.72,1.99,1.24,0.29,1.91,1.38,2.8,1.94,2015-11-10 07:00:00,7.0,6.0,6.0,0.0,8.0,4.0,15.0,0.0,19.0,26.0,18.0,8.0,0.0,0.0,0.0,0.0,0.0,1.0,0.0
314,11/11/2015 07:00,81.18,4.33,2.17,5.16,2.91,1.45,5.57,3.77,5.15,4.95,11.4,8.75,3.62,1.23,0.22,1.92,1.34,2.7,1.8,2015-11-11 07:00:00,0.0,46.0,47.0,4.0,24.0,14.0,13.0,0.0,28.0,13.0,11.0,0.0,0.0,0.0,0.0,0.0,0.0,0.0,0.0
315,12/11/2015 07:00,81.11,3.83,2.16,5.27,3.99,3.89,5.84,4.2,5.14,4.91,11.29,8.82,2.18,1.23,0.19,1.87,1.32,2.78,1.8,2015-11-12 07:00:00,0.0,0.0,0.0,0.0,0.0,0.0,0.0,0.0,0.0,0.0,0.0,0.0,0.0,0.0,0.0,0.0,0.0,0.0,0.0
316,13/11/2015 07:00,81.01,3.55,1.99,5.67,5.77,3.09,5.99,4.99,5.39,4.95,11.26,8.48,1.98,1.23,0.31,1.74,1.53,2.78,2.0,2015-11-13 07:00:00,19.0,12.0,8.0,7.0,28.0,27.0,18.0,40.0,23.0,21.0,13.0,19.0,0.0,22.0,45.0,45.0,55.0,48.0,66.0
317,14/11/2015 07:00,80.96,3.31,1.94,6.36,5.79,3.36,6.23,5.69,5.86,5.05,11.22,8.33,1.82,1.23,0.36,1.92,1.56,2.65,2.0,2015-11-14 07:00:00,0.0,0.0,0.0,0.0,0.0,0.0,0.0,0.0,0.0,3.0,0.0,0.0,0.0,0.0,0.0,0.0,0.0,0.0,0.0
318,15/11/2015 07:00,80.94,3.43,1.88,6.69,5.77,2.92,6.63,6.51,6.27,5.16,11.16,8.35,1.93,1.23,0.29,1.93,2.21,2.85,2.08,2015-11-15 07:00:00,0.0,0.0,0.0,0.0,0.0,0.0,0.0,0.0,0.0,0.0,0.0,0.0,0.0,0.0,0.0,0.0,0.0,0.0,0.0
319,16/11/2015 07:00,80.96,3.55,1.99,6.98,5.66,2.63,6.98,6.98,6.71,5.35,11.1,8.45,2.0,1.24,0.31,1.88,2.49,2.8,2.05,2015-11-16 07:00:00,0.0,0.0,0.0,0.0,0.0,0.0,0.0,0.0,0.0,0.0,0.0,0.0,0.0,0.0,0.0,0.0,0.0,0.0,0.0
320,17/11/2015 07:00,80.92,3.51,2.12,7.0,5.52,2.38,7.27,7.0,6.85,5.54,11.1,8.44,1.89,1.24,0.33,1.82,2.3,2.75,2.05,2015-11-17 07:00:00,0.0,0.0,0.0,0.0,0.0,0.0,0.0,0.0,0.0,0.0,0.0,0.0,0.0,0.0,0.0,0.0,0.0,0.0,0.0
321,18/11/2015 07:00,80.86,3.56,2.26,6.87,5.37,2.14,7.49,7.18,6.75,5.74,11.13,8.55,2.0,1.24,0.31,1.87,1.95,2.75,2.05,2015-11-18 07:00:00,4.0,7.0,4.0,0.0,30.0,8.0,9.0,0.0,14.0,9.0,15.0,7.0,0.0,2.0,5.0,2.0,1.0,1.0,0.0
322,19/11/2015 07:00,80.88,3.31,2.27,6.72,5.16,1.89,7.64,6.77,6.51,5.94,11.1,8.56,2.06,1.23,0.29,1.88,1.73,2.55,2.2,2015-11-19 07:00:00,0.0,0.0,0.0,0.0,0.0,0.0,0.0,2.0,0.0,2.0,0.0,0.0,0.0,0.0,0.0,0.0,0.0,2.0,0.0
323,20/11/2015 07:00,80.81,2.92,2.04,6.58,4.87,1.72,7.65,6.34,6.22,6.16,11.1,8.42,2.03,1.23,0.29,2.02,1.59,2.57,2.7,2015-11-20 07:00:00,3.0,8.0,7.0,0.0,7.0,9.0,9.0,9.0,11.0,14.0,5.0,3.0,9.0,12.0,22.0,11.0,8.0,2.0,5.0
324,21/11/2015 07:00,80.84,2.47,1.8,6.42,4.38,1.6,7.58,5.88,5.93,6.4,11.06,8.4,1.95,1.22,0.36,2.37,1.53,2.6,2.75,2015-11-21 07:00:00,0.0,0.0,0.0,0.0,0.0,0.0,0.0,0.0,0.0,0.0,0.0,0.0,0.0,0.0,0.0,0.0,0.0,0.0,0.0
325,22/11/2015 07:00,80.8,2.15,1.59,6.24,3.99,1.51,7.47,5.44,5.65,6.56,11.02,8.46,2.04,1.22,0.38,2.25,1.51,2.38,2.1,2015-11-22 07:00:00,0.0,0.0,0.0,0.0,0.0,0.0,0.0,0.0,0.0,0.0,0.0,0.0,0.0,0.0,0.0,0.0,0.0,0.0,0.0
326,23/11/2015 07:00,80.77,1.86,1.39,6.01,3.7,1.43,7.33,4.97,5.42,6.66,10.99,8.33,1.97,1.22,0.43,2.14,1.68,2.2,2.0,2015-11-23 07:00:00,0.0,0.0,0.0,0.0,0.0,0.0,0.0,0.0,0.0,0.0,0.0,0.0,0.0,0.0,0.0,0.0,0.0,0.0,0.0
327,24/11/2015 07:00,80.77,1.6,1.25,5.7,3.39,1.38,7.15,4.44,5.16,6.67,10.95,8.3,1.8,1.24,0.33,2.18,1.72,2.45,2.35,2015-11-24 07:00:00,0.0,0.0,0.0,0.0,0.0,0.0,0.0,0.0,0.0,0.0,0.0,0.0,0.0,0.0,0.0,0.0,0.0,0.0,0.0
328,25/11/2015 07:00,80.75,1.37,1.18,5.17,3.07,1.33,6.9,3.91,4.93,6.59,10.94,8.15,1.91,1.25,0.29,2.24,1.63,2.5,2.3,2015-11-25 07:00:00,0.0,0.0,0.0,0.0,0.0,0.0,0.0,0.0,0.0,0.0,0.0,0.0,0.0,0.0,0.0,0.0,0.0,0.0,0.0
329,26/11/2015 07:00,80.71,1.21,1.15,4.17,2.75,1.27,6.54,3.45,4.75,6.45,10.89,8.15,1.99,1.24,0.33,2.19,1.54,2.31,2.35,2015-11-26 07:00:00,0.0,0.0,0.0,0.0,0.0,0.0,0.0,0.0,0.0,0.0,0.0,0.0,0.0,0.0,0.0,0.0,0.0,0.0,0.0
330,27/11/2015 07:00,80.69,1.17,1.11,3.01,2.48,1.22,5.91,3.13,4.65,6.25,10.9,8.15,1.84,1.22,0.31,2.04,1.48,2.32,2.25,2015-11-27 07:00:00,0.0,4.0,6.0,0.0,3.0,1.0,0.0,0.0,2.0,0.0,0.0,0.0,1.0,0.0,0.0,0.0,0.0,0.0,0.0
331,28/11/2015 07:00,80.62,2.75,1.45,2.47,2.7,1.52,5.03,2.98,4.65,5.96,10.95,8.02,1.79,1.21,0.24,2.01,1.41,2.1,2.27,2015-11-28 07:00:00,9.0,22.0,20.0,30.0,36.0,29.0,30.0,5.0,22.0,20.0,16.0,16.0,14.0,5.0,6.0,6.0,3.0,8.0,4.0
332,29/11/2015 07:00,80.62,3.67,1.39,2.24,2.97,1.43,4.09,3.16,4.59,5.45,10.88,8.0,1.82,1.2,0.22,2.03,1.36,2.25,2.35,2015-11-29 07:00:00,0.0,0.0,0.0,0.0,0.0,0.0,0.0,0.0,0.0,0.0,0.0,0.0,0.0,0.0,0.0,0.0,0.0,0.0,0.0
333,30/11/2015 07:00,80.62,4.17,1.42,1.87,2.97,1.32,3.47,3.25,4.5,4.66,10.84,8.01,1.96,1.2,0.17,2.0,1.34,1.95,2.2,2015-11-30 07:00:00,0.0,0.0,0.0,0.0,0.0,0.0,0.0,0.0,0.0,0.0,0.0,0.0,0.0,0.0,0.0,0.0,0.0,0.0,0.0
334,01/12/2015 07:00,80.62,3.99,1.62,1.68,2.67,1.27,3.07,3.43,4.44,3.81,10.8,8.0,1.93,1.19,0.14,1.9,1.33,1.62,1.95,2015-12-01 07:00:00,0.0,0.0,0.0,0.0,0.0,0.0,0.0,0.0,0.0,0.0,0.0,0.0,0.0,0.0,0.0,0.0,0.0,0.0,0.0
335,02/12/2015 07:00,80.59,3.22,1.65,1.57,2.4,1.21,2.83,3.6,4.41,3.23,10.8,8.04,1.94,1.19,0.1,1.85,1.32,1.5,1.95,2015-12-02 07:00:00,0.0,0.0,0.0,0.0,0.0,0.0,0.0,0.0,0.0,0.0,0.0,0.0,0.0,0.0,0.0,0.0,0.0,0.0,0.0
336,03/12/2015 07:00,80.65,2.11,1.53,1.5,2.26,1.16,2.67,3.77,4.44,2.91,10.8,8.0,1.91,1.19,0.05,1.78,1.3,1.58,1.97,2015-12-03 07:00:00,0.0,0.0,0.0,0.0,0.0,0.0,0.0,0.0,0.0,0.0,0.0,0.0,0.0,0.0,0.0,0.0,0.0,0.0,0.0
337,04/12/2015 07:00,80.62,1.46,1.31,1.45,2.24,1.13,2.53,3.93,4.51,2.73,10.85,7.89,1.89,1.18,0.05,1.67,1.3,1.38,1.66,2015-12-04 07:00:00,2.0,1.0,2.0,0.0,35.0,15.0,9.0,2.0,4.0,7.0,0.0,2.0,0.0,1.0,0.0,0.0,0.0,1.0,10.0
338,05/12/2015 07:00,80.62,1.27,1.1,1.81,3.47,1.14,2.49,4.07,4.56,2.6,10.85,7.87,1.83,1.18,0.0,1.68,1.25,1.4,1.8,2015-12-05 07:00:00,0.0,0.0,0.0,0.0,0.0,0.0,0.0,0.0,0.0,14.0,0.0,0.0,0.0,0.0,0.0,0.0,0.0,0.0,0.0
339,06/12/2015 07:00,80.62,1.16,1.03,2.52,4.38,1.74,2.7575,4.37,4.68,2.5,10.88,7.87,1.82,1.18,0.0,1.76,1.24,1.55,2.15,2015-12-06 07:00:00,0.0,0.0,0.0,0.0,0.0,0.0,0.0,0.0,0.0,0.0,0.0,0.0,0.0,0.0,0.0,0.0,0.0,0.0,0.0
340,07/12/2015 07:00,80.65,1.06,0.86,2.86,5.28,2.47,2.7975,4.17,4.65,2.51,10.88,7.87,1.83,1.36,0.0,1.76,1.2,1.65,1.9,2015-12-07 07:00:00,0.0,0.0,0.0,0.0,0.0,0.0,0.0,0.0,0.0,0.0,0.0,0.0,0.0,0.0,0.0,0.0,0.0,0.0,0.0
341,08/12/2015 07:00,80.71,0.97,0.85,2.77,5.42,2.37,4.045,3.91,4.51,2.7424999999999997,10.85,7.82,1.83,1.37,0.0,1.69,1.2,1.37,1.56,2015-12-08 07:00:00,0.0,0.0,0.0,0.0,0.0,0.0,0.0,0.0,0.0,0.0,0.0,0.0,0.0,0.0,0.0,0.0,0.0,0.0,0.0
342,09/12/2015 07:00,80.62,0.89,0.9,2.57,5.19,2.12,2.9825,4.03,4.58,2.93,10.9,7.88,1.83,1.37,0.0,1.62,1.21,1.2,1.5,2015-12-09 07:00:00,0.0,0.0,0.0,0.0,0.0,0.0,0.0,10.0,0.0,0.0,0.0,0.0,0.0,0.0,0.0,0.0,10.0,14.0,15.0
343,10/12/2015 07:00,80.65,0.85,0.81,2.49,4.39,1.82,2.9225,4.01,4.58,3.03,10.85,7.83,1.72,1.38,0.0,1.65,1.19,1.2,1.5,2015-12-10 07:00:00,1.0,4.0,3.0,0.0,0.0,0.0,0.25,0.0,2.0,0.0,0.0,2.0,1.0,1.0,0.0,1.0,0.0,0.0,0.0
344,11/12/2015 07:00,80.62,0.73,0.84,2.38,3.38,1.59,2.9,3.75,4.51,2.795,10.85,7.75,1.62,1.38,0.0,1.6,1.17,1.23,1.68,2015-12-11 07:00:00,0.0,0.0,0.0,0.0,0.0,0.0,0.0,0.0,0.0,0.0,0.0,0.0,0.0,0.0,0.0,0.0,0.0,0.0,0.0
345,12/12/2015 07:00,80.62,0.72,0.73,2.1,2.63,1.43,3.02,3.22,4.36,3.05,10.85,7.65,1.55,1.38,0.0,1.54,1.16,1.31,1.65,2015-12-12 07:00:00,0.0,0.0,0.0,0.0,0.0,0.0,0.0,0.0,0.0,0.0,0.0,0.0,0.0,0.0,0.0,0.0,0.0,0.0,0.0
346,13/12/2015 07:00,80.65,0.86,0.91,1.77,2.4,1.39,2.83,2.67,4.37,2.99,10.89,7.69,1.61,1.4,0.05,1.5,1.18,1.3,1.75,2015-12-13 07:00:00,59.0,23.0,22.0,37.0,32.0,37.0,26.0,0.0,31.0,26.0,13.0,55.0,65.0,6.0,25.0,23.0,4.0,1.0,0.0
347,14/12/2015 07:00,80.65,0.98,0.91,1.57,2.48,1.53,2.64,2.68,4.29,2.91,10.88,7.6,1.63,1.41,0.0,1.52,1.15,1.64,1.75,2015-12-14 07:00:00,0.0,0.0,0.0,0.0,0.0,0.0,0.0,0.0,0.0,0.0,0.0,0.0,1.0,0.0,0.0,0.0,0.0,0.0,0.0
348,15/12/2015 07:00,80.62,1.11,0.93,1.49,2.68,1.52,2.46,2.51,4.28,2.76,10.85,7.73,1.71,1.42,0.0,1.64,1.14,1.45,2.18,2015-12-15 07:00:00,16.0,0.0,0.0,0.0,0.0,0.0,0.0,5.0,1.0,0.0,16.0,24.0,21.0,6.0,12.0,13.0,0.0,0.0,0.0
349,16/12/2015 07:00,80.62,1.05,0.85,1.44,2.53,1.43,2.35,2.47,4.21,2.65,10.8,7.78,1.69,1.42,0.0,1.64,1.14,2.1,2.18,2015-12-16 07:00:00,0.0,0.0,0.0,0.0,0.0,0.0,0.0,0.0,0.0,0.0,0.0,0.0,0.0,0.0,0.0,0.0,0.0,0.0,0.0
350,17/12/2015 07:00,80.62,0.98,0.94,1.4,2.26,1.33,2.28,2.42,4.14,2.53,10.78,7.75,1.59,1.13,0.19,1.52,1.17,1.9,2.0,2015-12-17 07:00:00,0.0,0.0,0.0,0.0,0.0,0.0,0.0,0.0,0.0,0.0,0.0,0.0,0.0,0.0,0.0,0.0,0.0,4.0,0.0
351,18/12/2015 07:00,80.62,1.23,1.09,1.46,2.9,1.76,2.33,2.85,4.36,2.57,10.85,7.71,1.7,1.17,1.32,1.85,1.53,2.0,1.58,2015-12-18 07:00:00,50.0,48.0,46.0,34.0,94.0,73.0,51.0,101.0,106.0,76.0,64.0,55.0,44.0,50.0,70.0,57.0,53.0,56.0,78.0
352,19/12/2015 07:00,80.61,3.44,1.85,2.54,5.1,2.64,3.11,5.63,5.31,3.15,10.86,7.7,4.36,1.22,1.34,3.25,2.28,2.3,2.43,2015-12-19 07:00:00,3.0,25.0,23.0,37.0,20.0,23.0,20.0,0.0,25.0,21.0,7.0,3.0,4.0,0.0,0.0,0.0,0.0,0.0,0.0
353,20/12/2015 07:00,80.65,4.19,1.89,3.27,4.99,2.41,3.85,5.96,5.62,3.75,10.85,7.71,1.9,1.38,2.82,3.75,2.67,2.4,2.43,2015-12-20 07:00:00,0.0,0.0,0.0,0.0,0.0,0.0,0.0,0.0,0.0,0.0,0.0,0.0,0.0,0.0,0.0,0.0,0.0,0.0,0.0
354,21/12/2015 07:00,80.71,4.86,1.83,3.76,5.06,2.47,4.15,6.0,5.72,4.14,10.81,7.85,1.73,1.4,3.04,3.95,2.16,2.11,2.32,2015-12-21 07:00:00,0.0,0.0,0.0,0.0,0.0,0.0,0.0,0.0,0.0,0.0,0.0,0.0,0.0,0.0,0.0,0.0,0.0,0.0,0.0
355,22/12/2015 07:00,80.71,5.28,2.05,4.15,5.3,2.44,4.41,5.86,5.64,4.26,10.89,7.84,1.72,1.34,3.18,3.63,1.86,2.18,2.38,2015-12-22 07:00:00,12.0,23.0,18.0,4.0,9.0,8.0,5.0,10.0,2.0,2.0,5.0,26.0,7.0,3.0,5.0,45.0,10.0,0.0,0.0
356,23/12/2015 07:00,80.75,5.82,2.0575,4.54,5.34,2.51,4.82,6.02,5.71,4.48,11.03,7.81,2.16,1.3,4.3,3.91,1.72,2.48,2.5,2015-12-23 07:00:00,35.0,72.0,52.0,49.0,32.0,31.0,24.0,28.0,58.0,43.0,59.0,41.0,61.0,20.0,52.0,33.0,19.0,15.0,10.0
357,24/12/2015 07:00,80.8,6.08,2.185,5.11,5.3,2.36,5.18,6.38,5.95,4.67,11.01,7.89,2.14,1.31,4.11,3.91,1.63,2.6,2.69,2015-12-24 07:00:00,0.0,1.0,7.0,0.0,0.0,1.0,0.0,5.0,0.0,0.0,0.0,0.0,0.0,0.0,0.0,0.0,1.0,3.0,6.0
358,25/12/2015 07:00,80.81,7.68,2.6925,5.75,5.38,2.34,5.51,6.59,6.12,4.86,11.0,7.98,1.94,1.32,3.64,3.42,1.83,2.85,2.95,2015-12-25 07:00:00,0.0,2.0,10.0,1.0,0.0,1.0,0.0,0.0,0.0,0.0,0.0,0.0,0.0,0.0,0.0,0.0,0.0,0.0,0.0
359,26/12/2015 07:00,80.84,7.57,3.415,6.31,5.63,2.38,5.83,6.68,6.2,5.04,11.03,7.98,1.87,1.31,2.82,3.13,2.49,2.85,3.0,2015-12-26 07:00:00,0.0,0.0,0.0,0.0,0.0,0.0,0.0,0.0,0.0,0.0,0.0,0.0,0.0,0.0,0.0,0.0,0.0,0.0,0.0
360,27/12/2015 07:00,80.84,6.92,3.9975,6.55,5.62,2.29,6.17,6.8,6.28,5.14,11.05,8.03,1.86,1.3,1.53,2.99,2.33,3.0,3.1,2015-12-27 07:00:00,0.0,0.0,0.0,0.0,0.0,0.0,0.0,0.0,0.0,0.0,0.0,0.0,0.0,0.0,0.0,0.0,0.0,0.0,0.0
361,28/12/2015 07:00,80.86,6.34,4.2525,6.54,5.56,2.1,6.49,7.02,6.41,5.26,11.08,8.02,1.84,1.3,1.25,2.89,1.94,3.01,3.2,2015-12-28 07:00:00,0.0,0.0,0.0,0.0,0.0,0.0,0.0,0.0,0.0,0.0,0.0,0.0,0.0,0.0,0.0,0.0,0.0,0.0,0.0
362,29/12/2015 07:00,80.88,5.86,3.755,6.46,5.44,1.83,6.74,7.22,6.57,5.41,11.1,8.0,1.82,1.3975,1.08,2.62,1.71,3.22,3.0,2015-12-29 07:00:00,0.0,0.0,0.0,0.0,0.0,0.0,0.0,0.0,0.0,0.0,0.0,0.0,0.0,0.0,0.0,0.0,0.0,0.0,0.0
363,30/12/2015 07:00,80.94,5.15,3.2800000000000002,6.41,5.25,1.6,6.85,7.4,6.72,5.59,11.2,8.03,1.92,1.3275,0.85,2.38,1.65,3.03,3.23,2015-12-30 07:00:00,63.0,1.0,2.0,12.0,0.0,0.0,9.0,75.0,12.0,5.0,80.0,41.0,11.0,11.0,5.0,14.0,37.0,85.0,1.0
364,31/12/2015 07:00,81.05,4.0,2.415,6.34,4.89,1.5,6.95,7.55,6.87,5.79,11.26,8.25,3.79,2.4375,4.1,2.68,5.94,3.25,3.34,2015-12-31 07:00:00,15.0,21.0,11.0,17.0,6.0,8.0,3.0,0.0,21.0,25.0,33.0,22.0,2.0,53.0,35.0,33.0,6.0,3.0,0.0
365,01/01/2016 07:00,81.11,2.65,1.9200000000000002,6.22,4.2,1.38,6.95,7.59,6.97,5.99,11.32,8.04,2.03,2.145,3.6,4.84,3.81,3.62,3.34,2016-01-01 07:00:00,0.0,0.0,1.0,0.0,0.0,0.0,0.0,0.0,0.0,0.0,0.0,0.0,0.0,0.0,0.0,0.0,0.0,0.0,0.0
366,02/01/2016 07:00,81.15,1.84,1.67,6.04,3.63,1.31,6.92,7.49,6.96,6.14,11.36,8.02,1.99,1.7449999999999999,4.15,6.24,2.61,3.55,3.35,2016-01-02 07:00:00,0.0,0.0,0.0,0.0,0.0,0.0,0.0,0.0,0.0,0.0,0.0,0.0,0.0,0.0,0.0,0.0,0.0,0.0,0.0
367,03/01/2016 07:00,81.19,1.74,1.4925000000000002,5.8,3.11,1.24,6.83,7.24,6.85,6.17,11.38,8.06,1.99,2.335,4.79,6.72,2.15,3.5,3.3,2016-01-03 07:00:00,0.0,0.0,0.0,0.0,0.0,0.0,0.0,0.0,0.0,0.0,0.0,0.0,0.0,0.0,0.0,0.0,0.0,0.0,0.0
368,04/01/2016 07:00,81.19,1.81,1.56,5.65,2.69,1.19,6.67,7.07,6.76,6.17,11.4,8.25,1.97,2.1875,5.12,6.04,1.98,3.41,3.25,2016-01-04 07:00:00,0.0,0.0,0.0,0.0,0.0,0.0,0.0,0.0,0.0,0.0,0.0,0.0,0.0,0.0,0.0,0.0,0.0,0.0,0.0
369,05/01/2016 07:00,81.19,1.68,1.195,4.56,2.42,1.17,6.4,6.3,6.32,6.1,11.42,8.2,1.94,1.62,4.84,4.96,1.82,3.25,3.25,2016-01-05 07:00:00,2.0,26.0,24.0,25.0,12.0,17.0,10.0,5.0,4.0,4.0,0.0,2.0,0.0,0.0,0.0,0.0,0.0,30.0,12.0
370,06/01/2016 07:00,81.19,1.83,1.17,3.8,2.64,1.29,6.05,5.39,5.88,6.1,11.43,8.0,1.99,1.56,3.86,4.07,2.24,3.24,3.42,2016-01-06 07:00:00,24.0,4.0,5.0,59.0,14.0,20.0,26.0,0.0,36.0,38.0,1.0,31.0,6.0,0.0,18.0,0.0,42.0,0.0,0.0
371,07/01/2016 07:00,81.19,2.15,1.2225,3.65,3.62,1.95,5.59,4.41,5.39,5.95,11.44,8.15,1.95,1.5275,2.73,3.47,2.41,3.35,3.58,2016-01-07 07:00:00,0.0,0.0,0.0,4.0,0.0,0.0,0.0,0.0,0.0,0.0,0.0,0.0,0.0,0.0,0.0,0.0,0.0,0.0,0.0
372,08/01/2016 07:00,81.19,2.49,2.0325,3.77,4.29,2.33,5.11,4.15,5.19,5.69,11.4,8.15,1.97,1.3625,1.39,3.1,2.09,3.05,3.24,2016-01-08 07:00:00,0.0,0.0,0.0,0.0,0.0,0.0,0.0,0.0,0.0,0.0,0.0,0.0,0.0,0.0,0.0,0.0,0.0,0.0,0.0
373,09/01/2016 07:00,81.18,2.74,2.4,4.0,5.38,2.5,4.8,4.26,5.17,5.29,11.4,8.22,1.98,1.2850000000000001,1.06,2.86,1.86,2.9,3.05,2016-01-09 07:00:00,0.0,0.0,0.0,0.0,0.0,0.0,0.0,0.0,0.0,0.0,0.0,0.0,0.0,0.0,0.0,0.0,0.0,0.0,0.0
374,10/01/2016 07:00,81.18,2.9,2.3850000000000002,4.23,5.58,2.35,4.69,4.61,5.19,4.9,11.35,8.15,1.98,1.27,0.85,2.66,1.73,2.8,3.2,2016-01-10 07:00:00,0.0,0.0,0.0,0.0,0.0,0.0,0.0,0.0,0.0,0.0,0.0,0.0,0.0,0.0,0.0,0.0,0.0,0.0,0.0
375,11/01/2016 07:00,81.15,2.81,2.3850000000000002,4.42,5.48,2.1,4.72,4.97,5.31,4.51,11.38,8.0,1.9,1.2874999999999999,0.71,2.51,1.59,2.7,2.92,2016-01-11 07:00:00,0.0,0.0,0.0,0.0,0.0,0.0,0.0,0.0,0.0,0.0,0.0,2.0,0.0,14.0,0.0,0.0,0.0,0.0,0.0
376,12/01/2016 07:00,81.11,2.17,2.01,4.62,5.25,1.81,4.78,5.21,5.39,4.36,11.35,8.2,1.86,1.2775,0.59,2.36,1.51,2.7,2.82,2016-01-12 07:00:00,0.0,0.0,0.0,0.0,0.0,0.0,0.0,0.0,0.0,0.0,0.0,0.0,0.0,0.0,0.0,0.0,0.0,0.0,0.0
377,13/01/2016 07:00,81.06,1.36,1.5525000000000002,4.84,4.77,1.56,4.88,5.24,5.42,4.31,11.31,8.11,1.92,1.39,0.47,2.35,1.43,2.6,2.72,2016-01-13 07:00:00,0.0,0.0,0.0,0.0,0.0,0.0,0.0,0.0,0.0,0.0,0.0,0.0,0.0,0.0,0.0,0.0,0.0,0.0,0.0
378,14/01/2016 07:00,81.06,1.13,1.4975,5.06,3.89,1.38,5.01,5.01,5.28,4.32,11.24,8.25,1.97,1.3,0.43,2.37,1.36,2.63,2.7,2016-01-14 07:00:00,0.0,0.0,0.0,0.0,0.0,0.0,0.0,0.0,0.0,0.0,0.0,0.0,0.0,0.0,0.0,0.0,0.0,0.0,0.0
379,15/01/2016 07:00,81.0,1.01,1.275,5.16,3.1,1.24,5.15,4.6,5.12,4.37,11.2,8.1,1.81,1.37,0.4,2.31,1.34,2.34,2.45,2016-01-15 07:00:00,0.0,0.0,0.0,0.0,0.0,0.0,0.0,0.0,0.0,0.0,0.0,0.0,0.0,0.0,0.0,0.0,0.0,0.0,0.0
380,16/01/2016 07:00,80.94,0.91,1.1675,5.11,2.54,1.12,5.28,4.03,4.91,4.44,11.17,8.2,1.96,1.42,0.43,2.31,1.28,2.2,2.65,2016-01-16 07:00:00,0.0,0.0,0.0,0.0,0.0,0.0,0.0,0.0,0.0,0.0,0.0,0.0,0.0,0.0,0.0,0.0,0.0,0.0,0.0
381,17/01/2016 07:00,80.92,0.83,1.0875,4.77,2.24,1.06,5.34,3.46,4.72,4.55,11.11,8.25,1.97,1.44,0.43,2.15,1.26,2.15,2.25,2016-01-17 07:00:00,0.0,0.0,0.0,0.0,0.0,0.0,0.0,0.0,0.0,0.0,0.0,0.0,0.0,0.0,0.0,0.0,0.0,0.0,0.0
382,18/01/2016 07:00,80.86,0.76,1.1175000000000002,3.86,2.09,0.98,5.24,2.91,4.62,4.63,11.1,8.1,1.97,1.45,0.36,2.04,1.22,1.85,2.1,2016-01-18 07:00:00,0.0,0.0,0.0,0.0,0.0,0.0,0.0,0.0,0.0,0.0,0.0,0.0,0.0,0.0,0.0,0.0,0.0,0.0,0.0
383,19/01/2016 07:00,80.84,0.7,1.04,2.57,1.99,0.94,4.82,2.52,4.51,4.66,11.05,8.09,1.92,1.5,0.26,2.0,1.21,2.05,2.25,2016-01-19 07:00:00,0.0,0.0,0.0,0.0,0.0,0.0,0.0,0.0,0.0,0.0,0.0,0.0,0.0,0.0,0.0,0.0,0.0,0.0,0.0
384,20/01/2016 07:00,80.8,0.65,1.0,1.8,1.91,0.88,3.91,2.3,4.43,4.57,11.0,7.95,1.76,1.53,0.19,1.94,1.19,2.0,2.06,2016-01-20 07:00:00,0.0,0.0,0.0,0.0,0.0,0.0,0.0,0.0,0.0,0.0,0.0,0.0,0.0,0.0,0.0,0.0,0.0,0.0,0.0
385,21/01/2016 07:00,80.75,0.61,0.8975000000000001,1.58,1.85,0.83,2.92,2.19,4.39,4.19,10.95,7.95,1.84,1.52,0.14,1.9,1.18,1.8,1.85,2016-01-21 07:00:00,0.0,0.0,0.0,0.0,0.0,0.0,0.0,0.0,0.0,0.0,0.0,0.0,0.0,0.0,0.0,3.0,10.0,0.0,0.0
386,22/01/2016 07:00,80.71,0.57,0.7949999999999999,1.48,1.8,0.78,2.47,2.08,4.28,3.49,10.87,7.9,1.83,1.56,0.12,1.82,1.19,1.78,1.7,2016-01-22 07:00:00,0.0,0.0,0.0,0.0,0.0,0.0,3.0,0.0,0.0,0.0,0.0,0.0,0.0,0.0,0.0,0.0,0.0,0.0,6.0
387,23/01/2016 07:00,80.62,0.53,0.7675000000000001,1.41,1.76,0.75,2.3,1.99,4.25,2.87,10.87,7.84,1.71,1.57,0.1,1.71,1.16,1.87,1.58,2016-01-23 07:00:00,0.0,0.0,0.0,0.0,0.0,0.0,0.0,0.0,0.0,0.0,0.0,0.0,0.0,0.0,0.0,0.0,0.0,0.0,0.0
388,24/01/2016 07:00,80.65,0.51,0.7575000000000001,1.35,1.72,0.71,2.22,1.92,4.12,2.59,10.78,7.7,1.56,1.6,0.03,1.67,1.16,1.97,2.23,2016-01-24 07:00:00,0.0,0.0,0.0,0.0,0.0,0.0,0.0,0.0,0.0,0.0,0.0,0.0,0.0,0.0,0.0,0.0,0.0,0.0,0.0
389,25/01/2016 07:00,80.5,0.48,0.7449999999999999,1.29,1.68,0.69,2.15,1.86,4.18,2.47,10.78,7.42,1.59,1.65,0.0,1.6,1.14,1.6,1.7,2016-01-25 07:00:00,0.0,0.0,0.0,0.0,0.0,0.0,0.0,0.0,0.0,0.0,0.0,0.0,0.0,0.0,6.0,0.0,0.0,0.0,4.0
390,26/01/2016 07:00,80.49,0.46,0.745,1.25,1.65,0.67,2.07,1.81,4.16,2.38,10.72,7.65,1.54,1.41,0.0,1.68,1.11,1.45,1.7,2016-01-26 07:00:00,0.0,3.0,2.0,0.0,0.0,0.0,1.0,0.0,0.0,0.0,0.0,0.0,0.0,0.0,0.0,0.0,0.0,0.0,0.0
391,27/01/2016 07:00,80.44,0.44,0.7575000000000001,1.24,1.64,0.64,2.03,1.77,4.05,2.31,10.69,7.73,1.7,1.38,0.0,1.78,1.06,1.87,2.1,2016-01-27 07:00:00,0.0,2.0,2.0,0.0,0.0,0.0,0.0,0.0,0.0,0.0,0.0,0.0,0.0,0.0,0.0,0.0,0.0,0.0,0.0
392,28/01/2016 07:00,80.4,0.43,0.7575000000000001,1.24,1.63,0.62,2.01,1.71,3.93,2.27,10.6,7.66,1.57,1.03,0.0,1.66,1.05,1.85,1.92,2016-01-28 07:00:00,0.0,0.0,0.0,0.0,0.0,0.0,0.0,0.0,0.0,0.0,0.0,0.0,0.0,0.0,0.0,0.0,0.0,0.0,0.0
393,29/01/2016 07:00,80.34,0.41,0.72,1.21,1.63,0.59,2.0,1.68,3.89,2.24,10.56,7.76,1.53,1.05,0.0,1.56,1.07,1.67,1.9,2016-01-29 07:00:00,0.0,0.0,0.0,0.0,0.0,0.0,0.0,0.0,0.0,0.0,0.0,0.0,0.0,0.0,0.0,0.0,0.0,0.0,0.0
394,30/01/2016 07:00,80.27,0.55,0.75,1.2,1.66,0.58,1.97,1.67,3.92,2.23,10.51,7.52,1.42,1.06,0.0,1.55,1.06,1.5,1.95,2016-01-30 07:00:00,0.0,24.0,0.0,0.0,11.0,0.0,0.0,0.0,0.0,0.0,0.0,2.0,0.0,0.0,1.0,1.0,1.0,1.0,1.0
395,31/01/2016 07:00,80.24,0.76,0.77,1.2,1.68,0.57,1.96,1.75,3.83,2.21,10.47,7.54,1.55,1.06,0.0,1.58,1.04,1.97,1.95,2016-01-31 07:00:00,0.0,0.0,0.0,0.0,0.0,0.0,0.0,0.0,0.0,0.0,0.0,0.0,0.0,0.0,0.0,0.0,0.0,0.0,0.0
396,01/02/2016 07:00,80.19,0.79,0.79,1.2,1.78,0.55,1.95,1.76,3.83,2.18,10.4,7.74,1.65,1.06,0.0,1.65,1.01,2.05,2.0,2016-02-01 07:00:00,0.0,0.0,0.0,0.0,0.0,0.0,0.0,0.0,0.0,0.0,0.0,0.0,0.0,0.0,0.0,0.0,0.0,0.0,0.0
397,02/02/2016 07:00,80.12,0.65,0.73,1.22,1.81,0.55,1.95,1.73,3.69,2.16,10.35,7.73,1.63,1.06,0.0,1.61,1.02,2.0,1.95,2016-02-02 07:00:00,0.0,0.0,0.0,0.0,0.0,0.0,0.0,0.0,0.0,0.0,0.0,0.0,0.0,0.0,0.0,0.0,0.0,0.0,0.0
398,03/02/2016 07:00,80.09,0.57,0.71,1.24,1.75,0.54,1.96,1.71,3.63,2.15,10.3,7.73,1.61,1.08,0.0,1.52,1.02,1.5,1.95,2016-02-03 07:00:00,0.0,0.0,0.0,0.0,0.0,0.0,0.0,0.0,0.0,0.0,0.0,0.0,0.0,0.0,0.0,0.0,0.0,0.0,0.0
399,04/02/2016 07:00,80.02,0.51,0.71,1.25,1.69,0.54,1.99,1.74,3.62,2.14,10.25,7.6,1.53,1.09,0.0,1.48,1.01,1.69,1.59,2016-02-04 07:00:00,0.0,0.0,0.0,0.0,0.0,0.0,0.0,0.0,0.0,0.0,0.0,0.0,0.0,0.0,0.0,0.0,0.0,0.0,0.0
400,05/02/2016 07:00,80.0,0.46,0.73,1.23,1.66,0.53,2.0,1.74,3.56,2.14,10.21,7.41,1.37,1.1,0.0,1.47,1.0,1.5,1.64,2016-02-05 07:00:00,0.0,0.0,0.0,0.0,0.0,0.0,2.0,0.0,0.0,0.0,0.0,0.0,0.0,0.0,0.0,0.0,0.0,0.0,0.0
401,06/02/2016 07:00,79.96,0.43,0.75,1.18,1.65,0.53,1.97,1.7,3.47,2.15,10.18,7.37,1.32,1.1,0.0,1.49,1.0,1.85,1.6,2016-02-06 07:00:00,0.0,0.0,0.0,0.0,0.0,0.0,0.0,0.0,0.0,0.0,0.0,0.0,0.0,0.0,0.0,0.0,0.0,0.0,0.0
402,07/02/2016 07:00,79.94,0.41,0.73,1.14,1.63,0.53,1.91,1.66,3.42,2.14,10.15,7.3,1.34,1.12,0.0,1.44,1.0025,1.78,1.85,2016-02-07 07:00:00,0.0,0.0,0.0,0.0,0.0,0.0,0.0,0.0,0.0,0.0,0.0,0.0,0.0,0.0,0.0,0.0,0.0,0.0,0.0
403,08/02/2016 07:00,79.92,0.41,0.68,1.13,1.62,0.53,1.87,1.64,3.43,2.12,10.11,7.48,1.43,1.15,0.0,1.36,1.0,1.21,1.61,2016-02-08 07:00:00,44.0,0.0,0.0,0.0,0.0,0.0,0.0,12.0,0.0,0.0,7.0,14.0,3.0,1.0,1.0,8.0,11.0,9.0,18.0
404,09/02/2016 07:00,79.84,0.41,0.69,1.14,1.62,0.55,1.83,1.62,3.48,2.1,10.11,7.5,1.45,1.15,0.0,1.39,1.01,1.47,1.65,2016-02-09 07:00:00,12.0,9.0,5.0,24.0,1.0,6.0,10.0,3.0,14.0,10.0,20.0,12.0,10.0,7.0,5.0,7.0,10.0,9.0,11.0
405,10/02/2016 07:00,79.81,0.41,0.74,1.16,1.65,0.57,1.91,1.6,3.46,2.07,10.04,7.55,1.44,1.16,0.0,1.45,1.0,1.55,1.7,2016-02-10 07:00:00,0.0,0.0,0.0,0.0,0.0,0.0,0.0,0.0,0.0,0.0,0.0,0.0,0.0,0.0,0.0,0.0,0.0,0.0,0.0
406,11/02/2016 07:00,79.78,0.42,0.8,1.15,1.68,0.57,1.89,1.6,3.32,2.07,10.0,7.45,1.4,1.16,0.0,1.46,1.0,1.35,2.0,2016-02-11 07:00:00,0.0,0.0,0.0,0.0,0.0,0.0,0.0,0.0,0.0,0.0,0.0,0.0,0.0,0.0,0.0,0.0,0.0,0.0,0.0
407,12/02/2016 07:00,79.75,0.42,0.78,1.17,1.73,0.56,1.87,1.59,3.32,2.08,9.95,7.43,1.35,1.18,0.0,1.39,1.01,1.8,1.88,2016-02-12 07:00:00,0.0,0.0,0.0,0.0,0.0,0.0,0.0,0.0,0.0,0.0,0.0,0.0,0.0,0.0,0.0,0.0,0.0,0.0,0.0
408,13/02/2016 07:00,79.68,0.4,0.68,1.2,1.71,0.56,1.88,1.58,3.25,2.06,9.93,7.39,1.37,1.2,0.0,1.38,1.06,1.85,1.65,2016-02-13 07:00:00,0.0,0.0,0.0,0.0,0.0,0.0,2.0,30.0,0.0,0.0,0.0,0.0,0.0,0.0,30.0,36.0,26.0,37.0,38.0
409,14/02/2016 07:00,79.69,0.39,0.74,1.25,1.75,0.59,1.93,1.61,3.33,2.12,9.94,7.48,1.56,1.2,0.0,1.47,1.1,1.85,2.0,2016-02-14 07:00:00,40.0,7.0,18.0,25.0,20.0,18.0,31.0,0.0,96.0,70.0,34.0,38.0,10.0,26.0,36.0,13.0,22.0,1.0,0.0
410,15/02/2016 07:00,79.68,0.38,0.73,1.25,1.73,0.58,2.04,1.66,3.27,2.16,9.88,7.67,1.63,1.21,0.0,1.46,1.12,1.87,1.98,2016-02-15 07:00:00,0.0,0.0,0.0,0.0,0.0,0.0,0.0,0.0,0.0,0.0,0.0,0.0,0.0,0.0,0.0,0.0,0.0,0.0,0.0
411,16/02/2016 07:00,79.62,0.45,0.7,1.25,1.69,0.57,2.02,1.61,3.18,2.25,9.83,7.64,1.6,1.22,0.0,1.43,1.13,1.83,2.0,2016-02-16 07:00:00,0.0,0.0,0.0,0.0,0.0,0.0,0.0,0.0,0.0,0.0,0.0,0.0,0.0,0.0,0.0,0.0,0.0,0.0,0.0
412,17/02/2016 07:00,79.59,0.47,0.67,1.36,1.69,0.57,2.0,1.58,3.13,2.25,9.79,7.6,1.51,1.23,0.0,1.32,1.22,1.8,1.9,2016-02-17 07:00:00,0.0,0.0,0.0,0.0,0.0,0.0,0.0,45.0,0.0,0.0,0.0,0.0,0.0,0.0,0.0,2.0,15.0,26.0,28.0
413,18/02/2016 07:00,79.56,0.48,0.79,1.52,1.71,0.58,2.11,1.59,3.19,2.2,9.81,7.5,1.44,1.21,0.0,1.5,1.56,1.85,1.9,2016-02-18 07:00:00,28.0,24.0,32.0,14.0,12.0,8.0,12.0,0.0,12.0,10.0,21.0,40.0,7.0,30.0,15.0,24.0,47.0,13.0,15.0
414,19/02/2016 07:00,79.55,0.45,0.74,1.57,1.69,0.58,2.26,1.6,3.14,2.2,9.75,7.45,1.46,1.22,0.0,1.46,2.82,1.85,2.1,2016-02-19 07:00:00,0.0,0.0,0.0,0.0,0.0,0.0,0.0,11.0,0.0,0.0,0.0,0.0,0.0,0.0,0.0,0.0,8.0,22.0,23.0
415,20/02/2016 07:00,79.5,0.63,0.8,1.51,1.71,0.6,2.3,1.62,3.11,2.26,9.72,7.51,1.49,1.21,0.0,1.56,2.83,2.0,2.15,2016-02-20 07:00:00,13.0,18.0,15.0,0.0,4.0,1.0,1.0,12.5,4.0,0.0,4.0,15.0,4.0,1.0,4.0,10.0,26.0,24.0,27.0
416,21/02/2016 07:00,79.5,0.73,0.82,1.41,1.74,0.59,2.25,1.64,3.01,2.32,9.68,7.58,1.59,1.21,0.0,1.53,2.87,1.7,2.0,2016-02-21 07:00:00,0.0,0.0,0.0,0.0,0.0,0.0,0.0,0.0,0.0,0.0,0.0,0.0,0.0,0.0,0.0,0.0,0.0,0.0,0.0
417,22/02/2016 07:00,79.46,0.73,0.82,1.33,1.73,0.58,2.15,1.65,2.99,2.31,9.67,7.45,1.49,1.21,0.0,1.49,2.56,1.43,1.85,2016-02-22 07:00:00,0.0,0.0,0.0,0.0,0.0,0.0,0.0,0.0,0.0,0.0,0.0,0.0,0.0,0.0,0.0,0.0,0.0,0.0,0.0
418,23/02/2016 07:00,79.4,0.69,0.81,1.31,1.71,0.58,2.07,1.67,3.0,2.27,9.64,7.58,1.54,1.21,0.0,1.47,2.21,1.84,1.85,2016-02-23 07:00:00,0.0,0.0,0.0,0.0,0.0,0.0,0.0,0.0,0.0,0.0,0.0,0.0,0.0,0.0,0.0,0.0,0.0,0.0,0.0
419,24/02/2016 07:00,79.38,0.6,0.79,1.31,1.69,0.57,2.05,1.7,3.01,2.2,9.6,7.61,1.59,1.22,0.0,1.4,1.89,1.7,1.8,2016-02-24 07:00:00,0.0,0.0,0.0,0.0,0.0,0.0,0.0,0.0,0.0,0.0,0.0,0.0,0.0,0.0,0.0,0.0,0.0,0.0,0.0
420,25/02/2016 07:00,79.34,0.51,0.79,1.28,1.66,0.56,2.05,1.71,2.98,2.16,9.57,7.55,1.5,1.21,0.0,1.4,1.72,1.82,2.05,2016-02-25 07:00:00,0.0,0.0,0.0,0.0,0.0,0.0,0.0,0.0,0.0,0.0,0.0,0.0,0.0,0.0,0.0,0.0,0.0,0.0,0.0
421,26/02/2016 07:00,79.31,0.46,0.77,1.23,1.64,0.56,2.1,1.71,2.9,2.14,9.53,7.56,1.57,1.2,0.0,1.42,1.55,2.15,2.2,2016-02-26 07:00:00,32.0,0.0,0.0,0.0,0.0,0.0,0.0,5.0,0.0,0.0,0.0,28.0,1.0,0.0,5.0,6.0,15.0,4.0,7.0
422,27/02/2016 07:00,79.28,0.6,0.84,1.2,1.75,0.6,2.14,1.76,2.99,2.13,9.57,7.6,1.58,1.18,0.0,1.54,1.84,2.0,2.2,2016-02-27 07:00:00,21.0,30.0,25.0,27.0,35.0,26.0,29.0,31.25,16.0,11.0,26.0,22.0,11.0,19.0,25.0,35.0,32.0,22.0,24.0
423,28/02/2016 07:00,79.28,0.62,0.94,1.19,1.78,0.62,2.12,1.81,2.92,2.13,9.49,7.65,1.51,1.14,0.0,1.63,1.67,2.15,2.24,2016-02-28 07:00:00,0.0,0.0,0.0,0.0,0.0,0.0,0.0,0.0,0.0,0.0,0.0,0.0,0.0,0.0,0.0,0.0,0.0,0.0,0.0
424,29/02/2016 07:00,79.21,0.62,0.92,1.17,1.75,0.61,2.24,1.78,2.93,2.12,9.45,7.55,1.52,1.13,0.0,1.64,1.65,1.77,1.95,2016-02-29 07:00:00,0.0,0.0,0.0,0.0,0.0,0.0,0.0,0.0,0.0,0.0,0.0,0.0,0.0,0.0,0.0,0.0,0.0,0.0,0.0
425,01/03/2016 07:00,79.19,0.67,0.81,1.18,1.8,0.6,2.16,1.76,2.83,2.11,9.4,7.4,1.35,1.12,0.0,1.58,1.54,2.0,2.2,2016-03-01 07:00:00,0.0,0.0,0.0,0.0,0.0,0.0,0.0,0.0,0.0,0.0,0.0,0.0,0.0,0.0,0.0,0.0,0.0,0.0,0.0
426,02/03/2016 07:00,79.12,0.64,0.76,1.2,1.77,0.59,2.1,1.82,2.78,2.08,9.33,7.68,1.58,1.1,0.0,1.6,1.44,1.94,2.15,2016-03-02 07:00:00,0.0,0.0,0.0,0.0,0.0,0.0,0.0,0.0,0.0,0.0,0.0,0.0,0.0,0.0,0.0,0.0,0.0,0.0,0.0
427,03/03/2016 07:00,79.05,0.53,0.78,1.23,1.73,0.61,2.28,1.87,2.78,2.06,9.25,7.78,1.63,1.09,0.0,1.55,1.39,2.05,2.1,2016-03-03 07:00:00,0.0,2.0,11.0,0.0,3.0,11.0,2.0,0.0,0.0,1.0,0.0,0.0,0.0,0.0,0.0,0.0,0.0,0.0,0.0
428,04/03/2016 07:00,78.96,0.46,0.79,1.24,1.7,0.61,2.18,1.83,2.66,2.05,9.2,7.71,1.61,1.08,0.0,1.53,1.33,2.0,1.86,2016-03-04 07:00:00,0.0,0.0,0.0,0.0,0.0,0.0,0.0,0.0,0.0,0.0,0.0,0.0,0.0,0.0,0.0,0.0,0.0,0.0,0.0
429,05/03/2016 07:00,78.9,0.41,0.79,1.22,1.77,0.61,2.34,1.8,2.64,2.05,9.17,7.65,1.55,1.08,0.0,1.47,1.3,1.8,1.65,2016-03-05 07:00:00,0.0,0.0,0.0,0.0,0.0,0.0,1.0,0.0,0.0,0.0,0.0,0.0,0.0,0.0,0.0,0.0,0.0,13.0,0.0
430,06/03/2016 07:00,78.84,0.42,0.79,1.17,1.77,0.6,2.0,1.77,2.57,2.06,9.11,7.68,1.47,1.06,0.0,1.51,1.24,1.65,2.14,2016-03-06 07:00:00,0.0,22.0,9.0,0.0,0.0,0.0,0.0,0.0,0.0,0.0,0.0,0.0,0.0,0.0,0.0,0.0,0.0,0.0,0.0
431,07/03/2016 07:00,78.78,0.39,0.79,1.15,1.7525,0.6,2.21,1.74,2.52,2.05,9.03,7.55,1.38,1.04,0.0,1.58,1.2,1.6,1.95,2016-03-07 07:00:00,0.0,0.0,0.0,0.0,0.0,0.0,0.0,0.0,0.0,0.0,0.0,0.0,0.0,0.0,0.0,0.0,0.0,0.0,0.0
432,08/03/2016 07:00,78.74,0.43,0.73,1.15,1.88,0.61,2.19,1.72,2.48,2.02,8.94,7.53,1.38,1.03,0.0,1.54,1.18,1.45,1.84,2016-03-08 07:00:00,0.0,0.0,0.0,0.0,0.0,0.0,0.0,0.0,0.0,0.0,0.0,0.0,0.0,0.0,0.0,0.0,0.0,0.0,0.0
433,09/03/2016 07:00,78.68,0.42,0.66,1.16,1.715,0.62,2.05,1.67,2.37,1.99,8.89,7.55,1.42,1.02,0.0,1.47,1.18,1.5,1.75,2016-03-09 07:00:00,0.0,0.0,0.0,0.0,0.0,0.0,0.0,0.0,0.0,0.0,0.0,0.0,0.0,0.0,0.0,0.0,0.0,0.0,0.0
434,10/03/2016 07:00,78.56,0.39,0.69,1.15,1.75,0.63,1.96,1.63,2.33,1.97,8.84,7.6,1.45,1.01,0.0,1.5,1.15,2.05,2.6,2016-03-10 07:00:00,0.0,0.0,0.0,4.0,0.0,11.0,1.0,0.0,0.0,0.0,0.0,0.0,0.0,0.0,0.0,0.0,0.0,0.0,0.0
435,11/03/2016 07:00,78.53,0.37,0.69,1.14,1.73,0.62,2.08,1.61,2.31,1.97,8.77,7.65,1.52,1.02,0.0,1.5,1.15,2.7,2.6,2016-03-11 07:00:00,15.0,0.0,9.0,25.0,0.0,7.0,18.0,2.0,1.0,1.0,35.0,29.0,9.0,22.0,20.0,8.0,6.0,4.0,0.0
436,12/03/2016 07:00,78.49,0.36,0.75,1.16,1.7,0.61,1.99,1.6,2.23,1.97,8.72,7.44,1.42,1.0,0.0,1.58,1.14,2.0,2.2,2016-03-12 07:00:00,0.0,1.0,7.0,2.0,0.0,0.0,1.0,0.0,0.0,0.0,1.0,0.0,0.0,2.0,0.0,0.0,0.0,0.0,0.0
437,13/03/2016 07:00,78.44,0.35,0.75,1.14,1.67,0.6,2.12,1.59,2.14,1.97,8.66,7.43,1.38,0.98,0.0,1.62,1.13,2.0,2.18,2016-03-13 07:00:00,0.0,0.0,0.0,0.0,0.0,0.0,0.0,0.0,0.0,0.0,0.0,0.0,0.0,0.0,0.0,0.0,0.0,0.0,0.0
438,14/03/2016 07:00,78.42,0.34,0.7,1.14,1.65,0.59,1.93,1.58,2.12,1.98,8.6,7.46,1.49,0.98,0.0,1.55,1.15,1.6,1.9,2016-03-14 07:00:00,0.0,0.0,0.0,0.0,0.0,0.0,0.0,0.0,0.0,0.0,0.0,0.0,0.0,0.0,0.0,0.0,0.0,0.0,0.0
439,15/03/2016 07:00,78.36,0.33,0.68,1.18,1.63,0.58,1.85,1.56,2.05,1.96,8.55,7.63,1.6,0.98,0.0,1.48,1.15,1.28,1.71,2016-03-15 07:00:00,0.0,0.0,0.0,0.0,0.0,0.0,0.0,0.0,0.0,0.0,0.0,0.0,0.0,0.0,0.0,0.0,0.0,0.0,0.0
440,16/03/2016 07:00,78.31,0.32,0.69,1.23,1.61,0.56,1.91,1.55,2.02,1.95,8.5,7.7,1.66,0.98,0.0,1.44,1.14,1.3,1.65,2016-03-16 07:00:00,0.0,0.0,0.0,0.0,0.0,0.0,0.0,0.0,0.0,0.0,0.0,0.0,0.0,0.0,0.0,0.0,0.0,0.0,0.0
441,17/03/2016 07:00,78.28,0.32,0.66,1.27,1.59,0.5,1.9024999999999999,1.54,1.96,1.94,8.46,7.7,1.64,0.99,0.0,1.37,1.14,1.55,1.7,2016-03-17 07:00:00,0.0,0.0,0.0,0.0,0.0,0.0,0.0,0.0,0.0,0.0,0.0,0.0,0.0,0.0,0.0,0.0,0.0,0.0,0.0
442,18/03/2016 07:00,78.21,0.31,0.77,1.26,1.58,0.49,1.92,1.5,1.93,1.95,8.45,7.73,1.64,1.0,0.0,1.26,1.14,1.38,1.6,2016-03-18 07:00:00,0.0,0.0,0.0,0.0,0.0,0.0,0.0,0.0,0.0,0.0,0.0,0.0,0.0,0.0,0.0,0.0,0.0,0.0,0.0
443,19/03/2016 07:00,78.19,0.33,0.89,1.21,1.6,0.5,2.07,1.52,1.98,1.98,8.4,7.7,1.7,0.98,0.0,1.52,1.28,1.85,2.4,2016-03-19 07:00:00,23.0,15.0,16.0,24.0,16.0,7.0,10.0,20.0,38.0,15.0,35.0,23.0,12.0,22.0,37.0,33.0,35.0,14.0,8.0
444,20/03/2016 07:00,78.15,0.34,0.83,1.25,1.62,0.51,1.8,1.52,1.94,2.01,8.39,7.72,1.64,0.96,0.0,1.55,1.29,1.98,2.52,2016-03-20 07:00:00,15.0,2.0,2.0,7.0,15.0,12.0,12.0,2.0,15.0,12.0,25.0,21.0,10.0,8.0,6.0,9.0,8.0,7.0,6.0
445,21/03/2016 07:00,78.12,0.47,0.81,1.26,1.6150000000000002,0.54,1.95,1.55,1.95,2.02,8.35,7.63,1.62,0.95,0.0,1.52,1.39,2.0,1.92,2016-03-21 07:00:00,9.0,25.0,30.0,25.0,10.0,18.0,18.0,35.0,32.0,30.0,13.0,10.0,12.0,2.0,8.0,12.0,21.0,36.0,15.0
446,22/03/2016 07:00,78.06,0.68,0.88,1.36,1.92,0.56,1.97,1.65,2.02,2.07,8.34,7.65,1.64,0.95,0.0,1.52,1.66,1.4,1.75,2016-03-22 07:00:00,17.0,2.0,4.0,9.0,14.0,12.0,11.0,0.0,34.0,31.0,4.0,14.0,4.0,25.0,6.0,13.0,4.0,1.0,0.0
447,23/03/2016 07:00,78.06,0.9,0.93,1.46,2.03,0.56,2.21,1.69,2.03,2.14,8.23,7.63,1.65,0.94,0.0,1.53,1.66,1.24,1.75,2016-03-23 07:00:00,0.0,0.0,0.0,0.0,0.0,0.0,0.0,0.0,0.0,0.0,0.0,0.0,0.0,0.0,0.0,0.0,0.0,0.0,0.0
448,24/03/2016 07:00,78.03,0.9,0.94,1.54,2.12,0.58,2.29,1.75,2.05,2.18,8.22,7.33,1.53,0.93,0.0,1.53,1.59,1.41,1.56,2016-03-24 07:00:00,0.0,0.0,0.0,0.0,0.0,0.0,0.0,0.0,0.0,0.0,0.0,0.0,0.0,0.0,0.0,0.0,0.0,0.0,0.0
449,25/03/2016 07:00,78.0,0.82,0.97,1.66,2.06,0.62,2.32,1.82,2.1,2.2,8.19,7.52,1.51,0.92,0.0,1.56,1.46,2.1,2.44,2016-03-25 07:00:00,0.0,0.0,0.0,0.0,0.0,0.0,0.0,0.0,0.0,0.0,0.0,0.0,0.0,0.0,0.0,0.0,0.0,0.0,0.0
450,26/03/2016 07:00,77.99,0.71,1.01,1.74,1.95,0.67,2.29,1.89,2.18,2.22,8.22,7.46,1.51,0.92,0.0,1.59,1.4,2.1,2.45,2016-03-26 07:00:00,0.0,20.0,26.0,9.0,4.0,3.0,7.0,0.0,2.0,2.0,7.0,0.0,0.0,0.0,8.0,1.0,0.0,0.0,0.0
451,27/03/2016 07:00,77.96,1.45,1.29,2.0,2.02,0.76,2.43,1.97,2.27,2.27,8.3,7.47,1.52,0.93,0.0,1.55,1.38,1.8,2.03,2016-03-27 07:00:00,15.0,43.0,34.0,48.0,31.0,24.0,33.0,0.0,22.0,16.0,14.0,13.0,1.0,17.0,17.0,9.0,1.0,1.0,0.0
452,28/03/2016 07:00,78.0,2.35,1.43,2.56,2.37,0.86,2.69,2.04,2.34,2.4,8.26,7.48,1.54,0.92,0.0,1.53,1.33,1.55,1.95,2016-03-28 07:00:00,1.0,1.0,1.0,23.0,1.0,12.0,15.0,0.0,5.0,7.0,0.0,1.0,0.0,1.0,6.0,3.0,0.0,0.0,0.0
453,29/03/2016 07:00,78.03,2.84,1.38,2.89,3.27,0.95,3.1,2.27,2.45,2.56,8.26,7.35,1.34,0.91,0.0,1.58,1.29,1.4,1.75,2016-03-29 07:00:00,0.0,0.0,0.0,1.0,1.0,1.0,0.0,0.0,1.0,0.0,0.0,0.0,0.0,0.0,2.0,0.0,0.0,0.0,0.0
454,30/03/2016 07:00,78.0,2.71,1.34,3.12,3.4,1.11,3.45,2.62,2.69,2.79,8.27,7.4,1.32,0.89,0.0,1.61,1.27,1.1,1.8,2016-03-30 07:00:00,0.0,0.0,0.0,0.0,0.0,0.0,0.0,0.0,0.0,0.0,0.0,0.0,0.0,0.0,0.0,0.0,0.0,0.0,0.0
455,31/03/2016 07:00,78.03,2.32,1.33,3.35,3.26,1.4,3.63,2.88,2.9,3.02,8.23,7.3,1.28,0.9,0.0,1.59,1.24,1.2,1.8,2016-03-31 07:00:00,0.0,0.0,0.0,0.0,0.0,0.0,0.0,0.0,0.0,0.0,0.0,0.0,0.0,0.0,0.0,0.0,0.0,0.0,0.0
456,01/04/2016 07:00,78.05,1.83,1.31,3.62,3.1,1.51,3.69,3.04,3.04,3.16,8.22,7.2,1.24,0.91,0.0,1.56,1.23,1.34,1.6,2016-04-01 07:00:00,0.0,0.0,0.0,0.0,0.0,0.0,0.0,0.0,0.0,0.0,0.0,0.0,0.0,0.0,0.0,0.0,0.0,0.0,0.0
457,02/04/2016 07:00,78.09,1.29,1.25,3.86,2.84,1.45,3.88,3.06,3.1,3.26,8.28,7.25,1.28,0.92,0.12,1.55,2.06,1.7,1.75,2016-04-02 07:00:00,34.0,0.0,1.0,0.0,5.0,1.0,2.0,62.0,5.0,3.0,18.0,41.0,17.0,17.0,41.0,36.0,47.0,62.0,72.0
458,03/04/2016 07:00,78.09,1.09,1.25,4.03,2.53,1.34,4.1,2.95,3.08,3.37,8.34,7.28,1.46,0.9,0.29,1.59,3.93,1.8,1.85,2016-04-03 07:00:00,0.0,15.0,15.0,4.0,6.0,3.0,2.0,0.0,7.0,5.0,3.0,1.0,1.0,0.0,0.0,3.0,2.0,6.0,7.0
